;;;;;;;;;;;;;;;;;;;;;;;;;;;x
EVTDESC37725;The Hohenzollern king of Spain, controversial since his ascension to the throne and constantly balked in the royal courts by moarchists advocating a return to the Bourbon line, was shot dead in his carriage shortly after arriving in Madrid following a country outing. The country is left in chaos and once again without a monarch on the throne.;;;;;;;;;;;;x,,,,,,,,,,,,,,,,,,,,
EVT37725OPTA;Declare the Spanish Republic!;;;;;;;;;;;;x,,,,,,,,,,,,,,,,,,,,
EVT37725OPTB;Give the throne to Prince Alfonso.;;;;;;;;;;;;x,,,,,,,,,,,,,,,,,,,,
EVTNAME37730;The Abdication of Amadeo;;;;;;;;;;;;x,,,,,,,,,,,,,,,,,,,,,,
EVTDESC37730;King Amadeo, controversial since his ascension and constantly balked in the royal courts by moarchists advocating a return to the Bourbon line, has angrily declared Spain to be 'ungovernable' after the Hidalgo Affair forced him into conflict with the nation's military and has abdicated the throne. The country is left in chaos and once again without a monarch.;;;;;;;;;;;;x,,,,,,,,,,,,,,,,,,,,
EVT37730OPTA;Declare the Spanish Republic!;;;;;;;;;;;;x,,,,,,,,,,,,,,,,,,,,
EVT37730OPTB;Give the throne to Prince Alfonso.;;;;;;;;;;;;x,,,,,,,,,,,,,,,,,,,,
EVTNAME37735;A Return to Bourbon Rule;;;;;;;;;;;;x,,,,,,,,,,,,,,,,,,,,,,
EVTDESC37735;The Spanish Republic has been contentious since its inception. After a series of failed governments, many Spaniards have come to favor a return to the stability of Bourbon rule. In a coup led by Brigadier General Martinez Campos, the Republican army has declared its allegiance to Prince Alfonso -- son of the exiled Queen Isabella II -- and named him King of Spain.;;;;;;;;;;;;x,,,,,,,,,,,,,,,,,,,,
EVT37735OPTA;Long live the King!;;;;;;;;;;;;x,,,,,,,,,,,,,,,,,,,,
EVT37735OPTB;We will resist this coup attempt. To arms!;;;;;;;;;;;;x,,,,,,,,,,,,,,,,,,,,
EVTNAME37740;The Treaty of Paris, $YEAR$;;;;;;;;;;;;x,,,,,,,,,,,,,,,,,,,,,
EVTDESC37740;We are losing the war with $FROMCOUNTRY$, and it's only a matter of time before we're forced to submit to a humiliating defeat. The $FROMCOUNTRY_ADJ$ government has made it clear it considers our colonial holdings to be beyond our ability to control, and is willing to purchase them for a 'fair' price. Failure to submit to their demands will mean the war dragging on to its inevitable conclusion.;;;;;;;;;;;;x,,,,,,,,,,,,,,,,,,,,
EVT37740OPTA;Give them what they want.;;;;;;;;;;;;x,,,,,,,,,,,,,,,,,,,,,
EVT37740OPTB;We refuse! Let them fight for it!;;;;;;;;;;;;x,,,,,,,,,,,,,,,,,,,,,
EVTNAME37741;$FROMCOUNTRY$ Has Agreed;;;;;;;;;;;;x,,,,,,,,,,,,,,,,,,,,,,
EVTDESC37741;$FROMCOUNTRY$ has signed the Treaty of Paris. Their colonial holdings are ours, for a price.;;;;;;;;;;;;x,,,,,,,,,,,,,,,,,,,,,
EVT37741OPTA;Excellent!;;;;;;;;;;;;x,,,,,,,,,,,,,,,,,,,,,
EVTNAME37742;$FROMCOUNTRY$ Has Refused!;;;;;;;;;;;;x,,,,,,,,,,,,,,,,,,,,,,
EVTDESC37742;$FROMCOUNTRY$ has refused to sign the Treaty of Paris. The war continues!;;;;;;;;;;;;x,,,,,,,,,,,,,,,,,,,,,,
EVT37742OPTA;Make no additional demands.;;;;;;;;;;;;x,,,,,,,,,,,,,,,,,,,,,,
EVT37742OPTB;They will regret this. Lay claim to their colonies.;;;;;;;;;;;;x,,,,,,,,,,,,,,,,,,,,,,
EVTNAME37743;Carlist Propaganda;;;;;;;;;;;;x,,,,,,,,,,,,,,,,,,,,,,
EVTDESC37743;The Carlists have been spreading their propaganda into neighboring $PROVINCENAME$, and reports have it that their lies are finding a ready audience among the locals. We can put a stop to their efforts, though not without being rather indiscriminate in our arrests and reprisals among $PROVINCENAME$'s poor. Still, radical measures may be called for in order to stop the Carlists from gaining headway here.;;;;;;;;;;;;x,,,,,,,,,,,,,,,,,,,
EVT37743OPTA;Do whatever it takes to stop them.;;;;;;;;;;;;x,,,,,,,,,,,,,,,,,,,,,,
EVT37743OPTB;Let them talk.;;;;;;;;;;;;x,,,,,,,,,,,,,,,,,,,,,,
EVTNAME37744;Christino Propaganda;;;;;;;;;;;;x,,,,,,,,,,,,,,,,,,,,,,
EVTDESC37744;The Christinos have been spreading their propaganda into neighboring $PROVINCENAME$, and reports have it that their lies are finding a ready audience among the locals. We can put a stop to their efforts, though not without being rather indiscriminate in our arrests and reprisals among $PROVINCENAME$'s poor. Still, radical measures may be called for in order to stop the Christinos from gaining headway here.;;;;;;;;;;;;x,,,,,,,,,,,,,,,,,,,
EVT37744OPTA;Do whatever it takes to stop them.;;;;;;;;;;;;x,,,,,,,,,,,,,,,,,,,,,,
EVT37744OPTB;Let them talk.;;;;;;;;;;;;x,,,,,,,,,,,,,,,,,,,,,,
EVTNAME37745;Moroccan Border Dispute;;;;;;;;;;;;x,,,,,,,,,,,,,,,,,,,,,,
EVTDESC37745;A heated dispute has arisen between the Moroccans and our government over the boundaries of our holdings in Melilla. Some believe the Moroccans are attempting to gain sympathy from the French, but we have it on good authority that there will be no aid coming for them. Now may be the time for us to exert some of our authority over this African upstart.;;;;;;;;;;;;x,,,,,,,,,,,,,,,,,,,,,
EVT37745OPTA;We shall teach them a lesson.;;;;;;;;;;;;x,,,,,,,,,,,,,,,,,,,,,
EVT37745OPTB;This must be resolved peacefully.;;;;;;;;;;;;x,,,,,,,,,,,,,,,,,,,,,
EVTDESC37750;We have lost the war with the Americans,and Cuba has been wrested from our grasp. The American government has approached us intent on a treaty, suggesting we no longer have the power to hold onto our Pacific and North American colonies. They seek to offer us a 'reasonable' price for them. Some in the $COUNTRY_ADJ$ govrnment fear that, if we do not agree, it could mean further wars with the Americans for years to come.;;;;;;;;;;;;x,,,,,,,,,,,,,,,,,,
EVT37750OPTA;Give them what they want.;;;;;;;;;;;;x,,,,,,,,,,,,,,,,,,,,,
EVT37750OPTB;We refuse! Let them fight for it!;;;;;;;;;;;;x,,,,,,,,,,,,,,,,,,,,,
EVTNAME37751;We Have Lost The War;;;;;;;;;;;;x,,,,,,,,,,,,,,,,,,,,,,
EVTDESC37751;As impossible as it seems, we have lost the war against the Spanish. They retain their hold over Cuba and their other colonies. The American people are understandably shaken, but it seems their jingoistic fervor has only increased. A streak of anti-colonialism has arisen throughout the country, specifically targeting the powers of 'Old Europe'. Newspapers are demanding we gear up to liberate these colonies once and for all. If we agree, some fear this may be a tiger we cannot again cage.;;;;;;;;;;;;x,,,,,,,,,,,,,,,,,,
EVT37751OPTA;Calm the people. We do not want more war.;;;;;;;;;;;;x,,,,,,,,,,,,,,,,,,
EVT37751OPTB;Fan the flames while we can.;;;;;;;;;;;;x,,,,,,,,,,,,,,,,,,
EVTNAME36943;The New Zealand Colony;;;;;;;;;;;;x,,,,,,,,,,,,,,,,,,,,,,
EVTDESC36943;The arrival of European settlers, known locally as Pakeha, has resulted in an increasing amount of land purchased from the Maori. While this has improved local conditions, it has angered a large portion of the Maori portion who resent the European presence and accuse the British of breaking the Treaty of Waitingi.;;;;;;;;;;;;x,,,,,,,,,,,,,,,,,,,
EVT36943OPTA;All in the name of progress.;;;;;;;;;;;;x,,,,,,,,,,,,,,,,,,,
EVTNAME36950;The Danish Gold Coast;;;;;;;;;;;;x,,,,,,,,,,,,,,,,,,,,,,
EVTDESC36950;The Danish Gold Coast exists on the coast of the Ashanti Union, primarily the fortress of Chistiansborg near the city of Accra. The Danish are willing to sell their holdings to us, though that is likely to result in conflict with the Ashanti government -- who will see the move as encroachment of their territory.;;;;;;;;;;;;x,,,,,,,,,,,,,,,,,,,,
EVT36950OPTA;We agree to the sale.;;;;;;;;;;;;x,,,,,,,,,,,,,,,,,,,,
EVT36950OPTB;There's no need for conflict with the Ashanti.;;;;;;;;;;;;x,,,,,,,,,,,,,,,,,,,,
EVTNAME36955;Conflict with Burma;;;;;;;;;;;;x,,,,,,,,,,,,,,,,,,,,,,
EVTDESC36955;A British Commodore who was recently dispatched to Burma to negotiate several matters regarding the Treaty of Yandabo, signed in 1826 after the First Anglo-Burmese War, has initiated a naval confrontation with the Burmese under questionable circumstances. While many are calling this Commodore an 'irrational jingoist', the British cannot let this matter drop without losing a great deal of prestige.;;;;;;;;;;;;x,,,,,,,,,,,,,,,,,,,
EVT36955OPTA;We must defend British interests.;;;;;;;;;;;;x,,,,,,,,,,,,,,,,,,,,,,
EVT36955OPTB;It is better for Burma to remain an ally.;;;;;;;;;;;;x,,,,,,,,,,,,,,,,,,,,,,
EVTNAME36960;The Gold Coast Treaty;;;;;;;;;;;;x,,,,,,,,,,,,,,,,,,,,,,
EVTDESC36960;The $FROMCOUNTRY_ADJ$ government has approached us with the hopes of negotiating a treaty. They want to solidify control over the Gold Coast in Africa, specifically by annexing our colony at Sekondi. In return, they will recognize our colonial holdings elsewhere and encourage greater cooperation between our nations.;;;;;;;;;;;;x,,,,,,,,,,,,,,,,,,,,
EVT36960OPTA;We will sign the treaty.;;;;;;;;;;;;x,,,,,,,,,,,,,,,,,,,,
EVT36960OPTB;We refuse. Sekondi is ours.;;;;;;;;;;;;x,,,,,,,,,,,,,,,,,,,,
EVTNAME36961;The Dutch Have Agreed;;;;;;;;;;;;x,,,,,,,,,,,,,,,,,,,,
EVTDESC36961;The Dutch government has agreed to sign the Gold Coast Treaty. Sekondi is ours!;;;;;;;;;;;;x,,,,,,,,,,,,,,,,,,,,
EVT36961OPTA;Excellent.;;;;;;;;;;;;x,,,,,,,,,,,,,,,,,,,,
EVTNAME36962;The Dutch Have Refused;;;;;;;;;;;;x,,,,,,,,,,,,,,,,,,,,
EVTDESC36962;The Dutch government has refused to ratify our proposed treaty.;;;;;;;;;;;;x,,,,,,,,,,,,,,,,,,,,
EVT36962OPTA;Then we shall leave it at that.;;;;;;;;;;;;x,,,,,,,,,,,,,,,,,,,,
EVT36962OPTB;Then we must consider using force.;;;;;;;;;;;;x,,,,,,,,,,,,,,,,,,,,
EVTNAME36965;The Lagos Slave Trade;;;;;;;;;;;;x,,,,,,,,,,,,,,,,,,,,,,
EVTDESC36965;We outlawed the $COUNTRY_ADJ$ slave trade many years ago, but it continues in many African nations -- and the coastal city of Lagos in particular. Lagos has been a haven for slavers, providing unwilling natives to the trade on markets in defiance of all decent conventions. The notion has arisen that we should consider sending our ships in to liberate the natives there and establish a colony where they can receive civilized government.;;;;;;;;;;;;x,,,,,,,,,,,,,,,,,,,,
EVT36965OPTA;Send in our ships!;;;;;;;;;;;;x,,,,,,,,,,,,,,,,,,,,
EVT36965OPTB;This is too costly a venture.;;;;;;;;;;;;x,,,,,,,,,,,,,,,,,,,,
EVTNAME36966;$FROMCOUNTRY$ Seizes Lagos!;;;;;;;;;;;;x,,,,,,,,,,,,,,,,,,,,,,
EVTDESC36966;$FROMCOUNTRY_ADJ$ ships have sailed into Lagos, seizing the city and driving off the $COUNTRY_ADJ$ garrison. They claim they are 'liberating' the city from slavers, extending their benevolent rule on behalf of the locals. Resisting means war, but submitting would do nothing more than prove our lack of ability to face these foreigners. What should we do?;;;;;;;;;;;;x,,,,,,,,,,,,,,,,,,,
EVT36966OPTA;What can we do? We must submit.;;;;;;;;;;;;x,,,,,,,,,,,,,,,,,,,
EVT36966OPTB;If they want a war, we'll give them one!;;;;;;;;;;;;x,,,,,,,,,,,,,,,,,,,
EVTNAME36967;Pirates in the Arab Coast;;;;;;;;;;;;x,,,,,,,,,,,,,,,,,,,
EVTDESC36967;In 1838, under Muhsin bin Fadl, the Sultanate of Lahej ceded 194 sq. km (75 sq. miles) including Aden to the British East India Company. Pirate presence in the area, however, is disrupting our trade. Due to that, the British Crown is planning to land Royal Marines at Aden to secure the territory and stop attacks by pirates against British ships to India. \n The Sultan of Lahej will not be happy.;;;;;;;;;;;;x,,,,,,,,,,,,,,,,,,,
EVT36967OPTA;Who gives a hooch about the sultan anyway?;;;;;;;;;;;;x,,,,,,,,,,,,,,,,,,,
EVTNAME36968;Poverty in Ireland;;;;;;;;;;;;x,,,,,,,,,,,,,,,,,,,
EVTDESC36968;The Duke of Wellington, a tory, is known to have said: "There never was a country in which poverty existed to the extent that it exists in Ireland." \n \n Kohl, a German visitor to Ireland in the early 19th century, while travelling through rural Ireland, remarked: "Now I have seen Ireland, it seems to me that the poorest among the Letts, the Estonians and the Finlanders lead a life of comparative luxury.";;;;;;;;;;;;x,,,,,,,,,,,,,,,,,,,
EVT36968OPTA;Drat.;;;;;;;;;;;;x,,,,,,,,,,,,,,,,,,,
EVTNAME36970;The Suez Canal Company;;;;;;;;;;;;x,,,,,,,,,,,,,,,,,,,,,,
EVTDESC36970;With the 'International Commission for the Piercing of the Isthmus of Suez' having completed and assessed the Suez region as being possible to have a canal built, all that remains is to put the plan in motion. The Suez Canal Company intends to do just that, but in order for it to start it needs to put together a significant amount of capital -- thus it has been offering shares to our government, hoping as well for the political clout to influence Egypt into allowing the venture to proceed.;;;;;;;;;;;;x,,,,,,,,,,,,,,,,,,,
EVT36970OPTA;Allow them to have as much money as they want.;;;;;;;;;;;;x,,,,,,,,,,,,,,,,,,,
EVT36970OPTB;Invest a little more than they asked for.;;;;;;;;;;;;x,,,,,,,,,,,,,,,,,,,
EVT36970OPTC;Give them as much as they asked for.;;;;;;;;;;;;x,,,,,,,,,,,,,,,,,,,
EVT36970OPTD;Invest a little less than they asked for.;;;;;;;;;;;;x,,,,,,,,,,,,,,,,,,,
EVT36970OPTE;Invest the minimum amount.;;;;;;;;;;;;x,,,,,,,,,,,,,,,,,,,
EVTNAME36971;Suez Canal Finished;;;;;;;;;;;;x,,,,,,,,,,,,,,,,,,,
EVTDESC36971;On the year $YEAR$, the construction of the Suez Canal is finally finished. Numerous technical, political, and financial problems have been overcome and the final cost was more than double the original estimate. Many have died in accidents, but the canal is now finally ready for use. \n \n The opening will be performed by Khedive Ismail of Egypt and Sudan, and at Ismail's invitation our ship will be the first to cross the Canal. The opening ceremony will be held in a few days, as soon as the preparations are finished.;;;;;;;;;;;;x,,,,,,,,,,,,,,,,,,,
EVT36971OPTA;Glory for $COUNTRY$!;;;;;;;;;;;;x,,,,,,,,,,,,,,,,,,,
EVTNAME36972;Our Ships Crosses the Suez;;;;;;;;;;;;x,,,,,,,,,,,,,,,,,,,
EVTDESC36972;During the inauguration of the Suez Canal, our ship was the first ship to ever cross the Suez, bringing glory to our nation.;;;;;;;;;;;;x,,,,,,,,,,,,,,,,,,,
EVT36972OPTA;As it should be.;;;;;;;;;;;;x,,,,,,,,,,,,,,,,,,,
EVTNAME36973;Our Ship Crosses the Suez;;;;;;;;;;;;x,,,,,,,,,,,,,,,,,,,
EVTDESC36973;The Suez Canal, slated to be inaugurated soon, had a line of ships spending the night in line to cross the canal. The owner of the canal has the honour to have the first ship crossing the canal. But on the night before the canal was due to open, one of our Captains navigated his vessel, in total darkness and without lights, through the mass of waiting ships until it was in front of of the flagship! The canal will be open and we will be the first ones to cross.;;;;;;;;;;;;x,,,,,,,,,,,,,,,,,,,
EVT36973OPTA;They will not like this.;;;;;;;;;;;;x,,,,,,,,,,,,,,,,,,,
EVTNAME36974;$FROMCOUNTRY$ crosses the Suez;;;;;;;;;;;;x,,,,,,,,,,,,,,,,,,,
EVTDESC36974;On the night before the canal was due to open in $YEAR$, a $FROMCOUNTRY_ADJ$ captain navigated his vessel, in total darkness and without lights, through the mass of waiting ships until it was in front of our flagship. When dawn broke our officials were horrified to find that the $FROMCOUNTRY_ADJ$ Navy was first in line and that it would be impossible to pass them. The $FROMCOUNTRY_ADJ$ captain received both an official reprimand and an unofficial vote of thanks from the $FROMCOUNTRY_ADJ$ Admiralty for his actions in promoting $FROMCOUNTRY_ADJ$ interests and for demonstrating such superb seamanship.;;;;;;;;;;;;x,,,,,,,,,,,,,,,,,,,
EVT36974OPTA;$FROMCOUNTRY$ robbed us from our rightful glory!;;;;;;;;;;;;x,,,,,,,,,,,,,,,,,,,
EVTNAME36975;Intervention in Egypt?;;;;;;;;;;;;x,,,,,,,,,,,,,,,,,,,,,,
EVTDESC36975;We have received disturbing reports of rebellion in Egypt, on a scale where our interests in the Suez might become threatened. While it undoubtedly would appear to some that we are using this as an excuse, the $COUNTRY_ADJ$ government cannot idly stand by and watch such an important project be laid to waste by the ignorant. We must consider direct intervention.;;;;;;;;;;;;x,,,,,,,,,,,,,,,,,,,,
EVT36975OPTA;We must protect our investment.;;;;;;;;;;;;x,,,,,,,,,,,,,,,,,,,,
EVT36975OPTB;There is no need for us to act.;;;;;;;;;;;;x,,,,,,,,,,,,,,,,,,,,
EVTNAME36976;The Construction of the Kiel Canal;;;;;;;;;;;;x,,,,,,,,,,,,,,,,,,,,
EVTDESC36976;We have gathered engineers and specialists from across our country and we are ready to begin the construction of the Kiel Canal. The costs have been estimated but the we can always give them more resources to try and accelerate the construction.;;;;;;;;;;;;x,,,,,,,,,,,,,,,,,,,,
EVT369706PTA;Give them more than they estimated.;;;;;;;;;;;;x,,,,,,,,,,,,,,,,,,,,
EVT369706PTB;Give them the amount estimated.;;;;;;;;;;;;x,,,,,,,,,,,,,,,,,,,,
EVT369706PTC;Give them less than they estimated.;;;;;;;;;;;;x,,,,,,,,,,,,,,,,,,,,
EVTNAME36977;The Kiel Canal is Finished;;;;;;;;;;;;x,,,,,,,,,,,,,,,,,,,,
EVTDESC36977;The canal took years and thousands of workers to be built but today on $YEAR$, the canal was officially opened by the $COUNTRY_ADJ$ ruler for transiting from Brunsbuttel to Holtenau. The next day, a ceremony was held in Holtenau where the $COUNTRY_ADJ$ ruler laid the final stone.;;;;;;;;;;;;x,,,,,,,,,,,,,,,,,,,,
EVT36977OPTA;The canal will greatly help $COUNTRY$.;;;;;;;;;;;;x,,,,,,,,,,,,,,,,,,,,
EVTNAME36978;Construction of the Panama Canal;;;;;;;;;;;;x,,,,,,,,,,,,,,,,,,,,
EVTDESC36978;Today we will start building the Canal to connect the Atlantic and Pacific oceans. Our engineers are ready and a series of surveys of the area of the canal were done. The only thing left to do before we start the construction is define the budget of this colossal project. \n \n This promises to be one massive undertaking and when finished it will be, without a doubt, one of the biggest human achievements for decades to come.;;;;;;;;;;;;x,,,,,,,,,,,,,,,,,,,,
EVT36978OPTA;Allow them to have as much money as they need.;;;;;;;;;;;;x,,,,,,,,,,,,,,,,,,
EVT36978OPTB;Invest a little more than they asked for.;;;;;;;;;;;;x,,,,,,,,,,,,,,,,,,,
EVT36978OPTC;Give them as much as they asked for.;;;;;;;;;;;;x,,,,,,,,,,,,,,,,,,,
EVT36978OPTD;Invest a little less than they asked for.;;;;;;;;;;;;x,,,,,,,,,,,,,,,,,,,
EVT36978OPTE;Invest the minimum amount;;;;;;;;;;;;x,,,,,,,,,,,,,,,,,,,
EVTNAME36979;The Construction of the Panama Canal is Finished;;;;;;;;;;;;x,,,,,,,,,,,,,,,,,,,
EVTDESC36979;The Canal cut through mountains and had to continually be widened, and the mountains slopes reduced, to minimize landslides into the canal. Steam shovels had been invented but were still not enough. Other mechanical and electrical equipment were limited in its capabilities and steel equipment rusted rapidly in the tropical climate. Several health risks posed a threat to workers in the mosquito-infested Panamanian jungle, principally malaria and yellow fever, and it claimed thousands of lives. Conditions were downplayed in $COUNTRY$ to avoid recruitment problems, but the high mortality made it difficult to maintain an experienced workforce. \n Finally, on $YEAR$ the Panama Canal was finished and it will be open to business.;;;;;;;;;;;;x,,,,,,,,,,,,,,,,,,,
EVT36979OPTA;This will surely help our power projection.;;;;;;;;;;;;x,,,,,,,,,,,,,,,,,,,
EVTNAME36980;Change of Ownership;;;;;;;;;;;;x,,,,,,,,,,,,,,,,,,,
EVTDESC36980;Our recent conquest of Balboa led us to take over the construction of the Panama Canal. While the resources of the former owner are in the site and work on the Canal had started already, the construction will suffer a delay thanks to some damage on the site and the chaos and disorganization that arose from this ownership change.;;;;;;;;;;;;x,,,,,,,,,,,,,,,,,,,
EVT36980OPTA;A minor setback.;;;;;;;;;;;;x,,,,,,,,,,,,,,,,,,,
EVTDESC36981;Our recent conquest of Kiel led us to take over the construction of the Kiel Canal. While the resources of the former owner are in the site and work on the Canal had started already, the construction will suffer a delay thanks to some damage on the site and the chaos and disorganization that arose from this ownership change.;;;;;;;;;;;;x,,,,,,,,,,,,,,,,,,,
EVTDESC36982;Our recent conquest of Suez led us to take over the construction of the Suez Canal. While the resources of the former owner are in the site and work on the Canal had started already, the construction will suffer a delay thanks to some damage on the site and the chaos and disorganization that arose from this ownership change.;;;;;;;;;;;;x,,,,,,,,,,,,,,,,,,,
EVTNAME97150;The Talambó Incident;;;;;;;;;;;;x,,,,,,,,,,,,,,,,,,,,,,
EVTDESC97150;An alarming incident has occurred at the Talambó hacienda in Ica. According to reports, a fight broke out between two Spanish nationals and a much larger group of locals. One of the Spaniards was killed. This would be nothing more than a local matter had the event not come to the attention of a Spanish admiral... who has subsequently demanded the $COUNTRY_ADJ$ government issue a full apology to Spain. Considering it was not long ago that $COUNTRY$ fought for its independence from Spain, submitting to such an indignity would go over less than well with the $COUNTRY_ADJ$ people.;;;;;;;;;;;;x,,,,,,,,,,,,,,,,,,,,
EVT97150OPTA;Issue an apology and hope for the best.;;;;;;;;;;;;x,,,,,,,,,,,,,,,,,,,,
EVT97150OPTB;This is a local matter. It has nothing to do with Spain.;;;;;;;;;;;;x,,,,,,,,,,,,,,,,,,,,
EVTDESC97151;News has arrived in $CAPITAL$ regarding an incident in $FROMCOUNTRY$. According to reports, a fight broke out between two Spanish nationals and a much larger group of locals. One of the Spaniards was killed. This would be nothing more than a local matter had the event not come to the attention of a Spanish admiral... who subsequently demanded the $FROMCOUNTRY_ADJ$ government issue a full apology to Spain. They have done so, but some advisors bring up a possibility: if $FROMCOUNTRY$ is this fearful of Spanish power, perhaps now is the time to reassert our authority over our lost Spanish colonies? Cutting $FROMCOUNTRY$ down to size may force them to submit to our rule as a vassal.;;;;;;;;;;;;x,,,,,,,,,,,,,,,,,,,
EVT97151OPTA;That time has passed. Accept the apology and move on.;;;;;;;;;;;;x,,,,,,,,,,,,,,,,,,,
EVT97151OPTB;$FROMCOUNTRY$ must be brought into line.;;;;;;;;;;;;x,,,,,,,,,,,,,,,,,,,
EVTDESC97152;News has arrived in $CAPITAL$ regarding an incident in $FROMCOUNTRY$. According to reports, a fight broke out between two Spanish nationals and a much larger group of locals. One of the Spaniards was killed. This would be nothing more than a local matter had the event not come to the attention of a Spanish admiral... who subsequently demanded the $FROMCOUNTRY_ADJ$ government issue a full apology to Spain. Predictably, they have refused. This is a direct challenge to Spanish authority from a former colony. If we do not react in kind, we will lose a great deal of credibility. Perhaps now is the time to reassert our authority over $FROMCOUNTRY$? Cutting them down to size may force them to submit to our rule as a vassal.;;;;;;;;;;;;x,,,,,,,,,,,,,,,,,,,
EVT97152OPTA;There is no point in pursuing the matter.;;;;;;;;;;;;x,,,,,,,,,,,,,,,,,,,
EVT97152OPTB;$FROMCOUNTRY$ must be brought into line.;;;;;;;;;;;;x,,,,,,,,,,,,,,,,,,,
EVTNAME97153;The Spanish Royal Commissary;;;;;;;;;;;;x,,,,,,,,,,,,,,,,,,,,,,
EVTDESC97153;A Spanish deputy by the name of Eusebio de Salazar y Mazaredo has arrived to negotiate with the $COUNTRY_ADJ$ government regarding the Talambó incident. The problem, however, is that he carries with him the title of Royal Commissary. This is a title reserved for officials dealing with Spanish colonies, not ambassadors to sovereign nations. This is a deliberate insult to $COUNTRY$!;;;;;;;;;;;;x,,,,,,,,,,,,,,,,,,,
EVTNAME97155;Submitting to Spain;;;;;;;;;;;;x,,,,,,,,,,,,,,,,,,,,,,
EVTDESC97155;We have been overrun by Spain, and now have no choice but to surrender our sovereignty to our former colonial overlords. It is a bitter day.;;;;;;;;;;;;x,,,,,,,,,,,,,,,,,,,,,
EVT97155OPTA;Our time shall come again.;;;;;;;;;;;;x,,,,,,,,,,,,,,,,,,,,,
EVTNAME97156;$FROMCOUNTRY$ Submits;;;;;;;;;;;;x,,,,,,,,,,,,,,,,,,,,,,
EVTDESC97156;An envoy from $FROMCOUNTRY$ has arrived with the expected news: they have agreed to submit themselves to Spanish rule once again, if we so choose. Some might wonder if it's worthwhile for Spain to involve itself in South American affairs, particularly since they will ultimately try to rebel out from under us. Perhaps we have proven our point?;;;;;;;;;;;;x,,,,,,,,,,,,,,,,,,,,
EVT97156OPTA;They've been taught their lesson.;;;;;;;;;;;;x,,,,,,,,,,,,,,,,,,,,
EVT97156OPTB;Set up a viceroyalty to rule in our name.;;;;;;;;;;;;x,,,,,,,,,,,,,,,,,,,,
EVTNAME97160;The Return of the Imperialists;;;;;;;;;;;;x,,,,,,,,,,,,,,,,,,,,,,
EVTDESC97160;Spanish imperialism has raised its head once again, with the Spanish throne having gone to war with a neighbour in an effort to restore their lost influence. The $COUNTRY_ADJ$ people are rightfully worried at what this means, and there are calls for us to take a stand.;;;;;;;;;;;;x,,,,,,,,,,,,,,,,,,,,
EVT97160OPTA;We do not want to get involved.;;;;;;;;;;;;x,,,,,,,,,,,,,,,,,,,,,,
EVT97160OPTB;Inform the Spanish they are not welcome.;;;;;;;;;;;;x,,,,,,,,,,,,,,,,,,,,,,
EVTNAME97161;$FROMCOUNTRY$ Protests;;;;;;;;;;;;x,,,,,,,,,,,,,,,,,,,,,,
EVTDESC97161;An envoy from $FROMCOUNTRY$ has issued a protest to our involvement in South America, telling us in no uncertain terms that we are not welcome.;;;;;;;;;;;;x,,,,,,,,,,,,,,,,,,,,,
EVT97161OPTA;So be it.;;;;;;;;;;;;x,,,,,,,,,,,,,,,,,,,,,
EVTNAME97165;Appeal to America?;;;;;;;;;;;;x,,,,,,,,,,,,,,,,,,,,,,
EVTDESC97165;The United States claims it intends to protect the New World from encroachment from imperial powers in Europe. Now that Spain has made its imperialist intentions evident, perhaps it is time we put the so-called Monroe Doctrine to the test?;;;;;;;;;;;;x,,,,,,,,,,,,,,,,,,,,,
EVT97165OPTA;No. We will stand on our own.;;;;;;;;;;;;x,,,,,,,,,,,,,,,,,,,,,
