;;;;;;;;;;;;;;;;;;;;;;;;;;;x
EVTDESC20115;A demonstration by $PROVINCECULTURE$ citizens in $PROVINCENAME$ quickly got out of hand as $COUNTRY_ADJ$ soldiers shot into the crowd to disperse it. A riot ensued, and several protesters were slain. Throughout $STATENAME$, the reaction has been one of outrage-- and there is an effort by some $PROVINCECULTURE$ malcontents to draw the attention of the world, just one more example of $COUNTRY$'s disregard for peace and civilized behavior-- or so they'll say.;;;;;;;;;;;;x,,,,,,,,,,
EVT20115OPTA;Let the world think what it likes.;;;;;;;;;;;;x,,,,,,,,,,
EVT20115OPTB;Suppress this. Now.;;;;;;;;;;;;x,,,,,,,,,,
EVTNAME38505;Death of the Sultan;;;;;;;;;;;;x,,,,,,,,,,,,,,,,,,,,,,
EVTDESC38505;The death of Sa'id bin Sultan Al-Busaid has left him with two sons, each of which has claimed Oman as their own to rule. The result of this struggle has brought in foreign mediation, with the resulting decree that the nation will be split into two sultanates: one in Zanzibar and one in Muscat, each ruled by one of Al-Basaid's sons.;;;;;;;;;;;;x,,,,,,,,,,,,,,,,,,,
EVT38505OPTA;One son shall rule Oman, and the other Zanzibar.;;;;;;;;;;;;x,,,,,,,,,,,,,,,,,,,
EVT38505OPTB;Never! Oman must remain united!;;;;;;;;;;;;x,,,,,,,,,,,,,,,,,,,
EVTNAME97000;The Revolution of Maria da Fonte;;;;;;;;;;;;x,,,,,,,,,,,,,,,,,,,,,,
EVTDESC97000;A growing dissatisfaction with the ruling government among Portugal's poor has grown into rebellion, spurred on by popular discontent with the prohibition against burials inside churches. The instigator of the initial riots is a woman by the name of Maria, and her nickname has come to be used to represent the rebellion -- which has a large contingent of peasant women among its supporters -- and which has been co-opted by revolutionaries in emulation of the rebellions elsewhere in Europe.;;;;;;;;;;;;x,,,,,,,,,,,,,,,,,,,,
EVT97000OPTA;This will come to nothing.;;;;;;;;;;;;x,,,,,,,,,,,,,,,,,,,,
EVTNAME97001;Peasant Revolt in $PROVINCENAME$;;;;;;;;;;;;x,,,,,,,,,,,,,,,,,,,,,,
EVTDESC97001;The Maria de Fonte rebellion has spread to $PROVINCENAME$, with the lower classes rising up in opposition to the ruling government. Many are calling for the government's resignation, and there are signs that Queen Maria II may engineer a coup to restore order.;;;;;;;;;;;;x,,,,,,,,,,,,,,,,,,,,
EVT97001OPTA;That is not going to happen.;;;;;;;;;;;;x,,,,,,,,,,,,,,,,,,,,
EVTNAME97002;End of the Revolution;;;;;;;;;;;;x,,,,,,,,,,,,,,,,,,,,,,
EVTDESC97002;Portuguese forces have managed to restore order in the countryside, and the peasantry have been brought back under control. The danger of a royal coup has ended.;;;;;;;;;;;;x,,,,,,,,,,,,,,,,,,,,,
EVT97002OPTA;I told you it would come to nothing.;;;;;;;;;;;;x,,,,,,,,,,,,,,,,,,,,,
EVTNAME97003;The Emboscada;;;;;;;;;;;;x,,,,,,,,,,,,,,,,,,,,,,
EVTDESC97003;Spurred on by the spreading revolts in Portugal, Queen Maria II has suspended the constitution and installed a reactionary government presided over by João Francisco de Saldanha Oliveira e Daun, 1st Duke of Saldanha. This has served to spur on the country's liberals to outrage, and begun talk of civil war.;;;;;;;;;;;;x,,,,,,,,,,,,,,,,,,,
EVT97003OPTA;There may be trouble ahead.;;;;;;;;;;;;x,,,,,,,,,,,,,,,,,,,
EVTNAME97006;The Occupation of Angola;;;;;;;;;;;;x,,,,,,,,,,,,,,,,,,,,,,
EVTDESC97006;Our forces are slowly pacifying the Angolan countryside. If we are fortunate, we will one day be able to connect our African colonies.;;;;;;;;;;;;x,,,,,,,,,,,,,,,,,,,,,
EVT97006OPTA;For the glory of Portugal!;;;;;;;;;;;;x,,,,,,,,,,,,,,,,,,,,,
EVTNAME97007;The Occupation of Mozambique;;;;;;;;;;;;x,,,,,,,,,,,,,,,,,,,,,,
EVTDESC97007;Our forces are slowly pacifying the Mozambican countryside. If we are fortunate, we will one day be able to connect our African colonies.;;;;;;;;;;;;x,,,,,,,,,,,,,,,,,,,,,
EVTNAME97008;Zanzibar Purchase;;;;;;;;;;;;x,,,,,,,,,,,,,,,,,,,,,
EVTDESC97008;$FROMCOUNTRY$ has offered to sell the Zanzibar coast to our current colonial administration in Tanganyika. It seems like a reasonable deal.;;;;;;;;;;;;x,,,,,,,,,,,,,,,,,,,,,
EVT97008OPTA;Accept the offer.;;;;;;;;;;;;x,,,,,,,,,,,,,,,,,,,,,
EVT97008OPTB;Reject the offer.;;;;;;;;;;;;x,,,,,,,,,,,,,,,,,,,,,
EVTNAME97009;Mombasa Purchase;;;;;;;;;;;;x,,,,,,,,,,,,,,,,,,,,,
EVTDESC97009;$FROMCOUNTRY$ has offered to sell the Mombasa coast to our current colonial administration in Kenya. It seems like a reasonable deal.;;;;;;;;;;;;x,,,,,,,,,,,,,,,,,,,,,
EVTNAME97010;The Portuguese Colonies;;;;;;;;;;;;x,,,,,,,,,,,,,,,,,,,,,,
EVTDESC97010;We have received an ultimatum from $FROMCOUNTRY$: surrender our colonies between Angola and Mozambique or suffer the consequences. The Portuguese people feel this is an incredible betrayal by the $FROMCOUNTRY_ADJ$. They have traditionally been our ally, and now they are trying to bully our rightful colonial holdings out of us? It cannot be borne!;;;;;;;;;;;;x,,,,,,,,,,,,,,,,,,,,,
EVT97010OPTA;We have no choice.;;;;;;;;;;;;x,,,,,,,,,,,,,,,,,,,,,
EVT97010OPTB;They will have to pry them from our fingers!;;;;;;;;;;;;x,,,,,,,,,,,,,,,,,,,,,
EVTNAME97011;$FROMCOUNTRY$ Has Agreed;;;;;;;;;;;;x,,,,,,,,,,,,,,,,,,,,,,
EVTDESC97011;$FROMCOUNTRY$ has agreed to our terms -- though they are unhappy about it.;;;;;;;;;;;;x,,,,,,,,,,,,,,,,,,,,,,
EVT97011OPTA;They will get over it.;;;;;;;;;;;;x,,,,,,,,,,,,,,,,,,,,,,
EVTNAME97012;$FROMCOUNTRY$ Has Refused!;;;;;;;;;;;;x,,,,,,,,,,,,,,,,,,,,,,
EVTDESC97012;$FROMCOUNTRY$ has refused our ultimatum, and all but dared $COUNTRY$ to take their colonies from them -- if we can.;;;;;;;;;;;;x,,,,,,,,,,,,,,,,,,,,,
EVT97012OPTA;Foolish!;;;;;;;;;;;;x,,,,,,,,,,,,,,,,,,,,,
EVTNAME97015;Regicide of King Carlos I;;;;;;;;;;;;x,,,,,,,,,,,,,,,,,,,,,,
EVTDESC97015;Upon returning to Lisbon from a brief trip abroad, King Carlos I and the royal family had their carriage fired upon by republican activists as they passed through the Terreiro do Paço. Three of the bullets struck and killed the King, while another fatally wounded the heir to the throne, Luis Filipe. During the turmoil, the police killed the assassins... but the King and the royal heir were not saved and were pronounced dead at the Naval Arsenal soon afterwards. Manuel, the king's youngest son, has been quickly acclaimed as the new King of Portugal.;;;;;;;;;;;;x,,,,,,,,,,,,,,,,
EVT97015OPTA;A national tragedy!;;;;;;;;;;;;x,,,,,,,,,,,,,,,,,,,,,
EVTNAME97020;The Republican Coup D'Etat;;;;;;;;;;;;x,,,,,,,,,,,,,,,,,,,,,,
EVTDESC97020;With the monarchy already weakened by the death of King Carlos, republican opponents have been able to gather considerable support in the capital. Members of the Carbonária, republican youth, and elements of the army have instigated a coup d'état in the palace. The young King Manuel and his family have reportedly escaped for exile to England, and only days later a new Portuguese Republic has been declared in Lisbon.;;;;;;;;;;;;x,,,,,,,,,,,,,,,,,,
EVT97020OPTA;Long live the Republic!;;;;;;;;;;;;x,,,,,,,,,,,,,,,,,,
EVT97020OPTB;Try to keep power with the monarchy!;;;;;;;;;;;;x,,,,,,,,,,,,,,,,,,
EVTNAME49511;Portuguese Mozambique;;;;;;;;;;;;x,,,,,,,,,,,,,,,,,,,,,,
EVTDESC49511;We must strive to consolidate our hold on Mozambique. For the glory of Portugal!;;;;;;;;;;;;x,,,,,,,,,,,,,,,,,,,,,,
EVT49511OPTA;We shall consider it.;;;;;;;;;;;;x,,,,,,,,,,,,,,,,,,,,,,
EVT49511OPTB;This is not in our interests.;;;;;;;;;;;;x,,,,,,,,,,,,,,,,,,,,,,
EVTNAME44330;The Dominion of Newfoundland;;;;;;;;;;;;x,,,,,,,,,,,,,,,,,,,,,,
EVTDESC44330;The colony of British Newfoundland has asked to be governed as an autonomous dominion within the empire.;;;;;;;;;;;;x,,,,,,,,,,,,,,,,,,,,,,
EVT44330OPTA;This can only be good for the empire.;;;;;;;;;;;;x,,,,,,,,,,,,,,,,,,,,,,
EVT44330OPTB;No, they shall remain under our direct control.;;;;;;;;;;;;x,,,,,,,,,,,,,,,,,,,,,,
EVT44330OPTC;Onwards to Newfoundland!;;;;;;;;;;;;x,,,,,,,,,,,,,,,,,,,,,,
EVTNAME44331;The Status of Newfoundland;;;;;;;;;;;;x,,,,,,,,,,,,,,,,,,,,,,
EVTDESC44331;The country's finances have collapsed and some are now suggesting that we'd be better served directly governed from London.;;;;;;;;;;;;x,,,,,,,,,,,,,,,,,,,,,,
EVT44331OPTA;We shall rejoin England as a full colony once more.;;;;;;;;;;;;x,,,,,,,,,,,,,,,,,,,,,,
EVT44331OPTB;We shall prevail.;;;;;;;;;;;;x,,,,,,,,,,,,,,,,,,,,,,
EVTNAME44332;The Australian Dominion;;;;;;;;;;;;x,,,,,,,,,,,,,,,,,,,,,,
EVTDESC44332;The colony of British Australia has asked to be governed as an autonomous dominion within the empire.;;;;;;;;;;;;x,,,,,,,,,,,,,,,,,,,,,,
EVT44332OPTC;Onwards to Australia!;;;;;;;;;;;;x,,,,,,,,,,,,,,,,,,,,,,
EVTNAME44333;The New Zealand Dominion;;;;;;;;;;;;x,,,,,,,,,,,,,,,,,,,,,,
EVTDESC44333;The colony of British New Zealand has asked to be governed as an autonomous dominion within the empire.;;;;;;;;;;;;x,,,,,,,,,,,,,,,,,,,,,,
EVT44333OPTC;Onwards to New Zealand!;;;;;;;;;;;;x,,,,,,,,,,,,,,,,,,,,,,
EVTNAME44334;The South African Dominion;;;;;;;;;;;;x,,,,,,,,,,,,,,,,,,,,,,
EVTDESC44334;The colony of British South Africa has asked to be governed as an autonomous dominion within the empire.;;;;;;;;;;;;x,,,,,,,,,,,,,,,,,,,,,,
EVT44334OPTC;Onwards to South Africa!;;;;;;;;;;;;x,,,,,,,,,,,,,,,,,,,,,,
EVTNAME44335;$COUNTRY_ADJ$ Territories;;;;;;;;;;;;x,,,,,,,,,,,,,,,,,,,,,,
EVTDESC44335;Our overlords are in control of territory that rightfully belongs to $COUNTRY$. Perhaps we should request to have it returned?;;;;;;;;;;;;x,,,,,,,,,,,,,,,,,,,,,,
EVT44335OPTA;Make the request.;;;;;;;;;;;;x,,,,,,,,,,,,,,,,,,,,,,
EVT44335OPTB;No. They won't return them anyhow.;;;;;;;;;;;;x,,,,,,,,,,,,,,,,,,,,,,
EVTNAME44336;$FROMCOUNTRY_ADJ$ Territories;;;;;;;;;;;;x,,,,,,,,,,,,,,,,,,,,,,
EVTDESC44336;We hold land overseas that rightfully belongs to our $FROMCOUNTRY_ADJ$ dominion. Perhaps it would be prudent to hand it over to them?;;;;;;;;;;;;x,,,,,,,,,,,,,,,,,,,,,,
EVT44336OPTA;Yes. They will make for a stronger ally.;;;;;;;;;;;;x,,,,,,,,,,,,,,,,,,,,,,
EVT44336OPTB;No. $FROMCOUNTRY$ has all the land it needs.;;;;;;;;;;;;x,,,,,,,,,,,,,,,,,,,,,,
EVTNAME44337;$FROMCOUNTRY$ Has Agreed;;;;;;;;;;;;x,,,,,,,,,,,,,,,,,,,,,,
EVTDESC44337;The $FROMCOUNTRY_ADJ$ government has agreed to the return of $COUNTRY_ADJ$ lands.;;;;;;;;;;;;x,,,,,,,,,,,,,,,,,,,,,,
EVT44337OPTA;Hurrah!;;;;;;;;;;;;x,,,,,,,,,,,,,,,,,,,,,,
EVTNAME44338;$FROMCOUNTRY$ Has Refused;;;;;;;;;;;;x,,,,,,,,,,,,,,,,,,,,,,
EVTDESC44338;The $FROMCOUNTRY_ADJ$ government has refused to return $COUNTRY_ADJ$ lands. They have made it clear that we should not ask again.;;;;;;;;;;;;x,,,,,,,,,,,,,,,,,,,,,,
EVT44338OPTA;Bastards!;;;;;;;;;;;;x,,,,,,,,,,,,,,,,,,,,,,
EVT44339OPTA;We must claim the Great White North.;;;;;;;;;;;;x,,,,,,,,,,,,,,,,,,,,,,
EVTNAME44340;The Alaskan Dominion;;;;;;;;;;;;x,,,,,,,,,,,,,,,,,,,,,,
EVTDESC44340;The question has arisen regarding what to do with our colony in Alaska, now that Canada has achieved independence.;;;;;;;;;;;;x,,,,,,,,,,,,,,,,,,,,,,
EVT44340OPTA;Allow it to join the Canadian Confederation.;;;;;;;;;;;;x,,,,,,,,,,,,,,,,,,,,,,
EVT44340OPTB;Grant it autonomy as a Dominion.;;;;;;;;;;;;x,,,,,,,,,,,,,,,,,,,,,,
EVT44340OPTC;It shall remain a $COUNTRY_ADJ$ colony.;;;;;;;;;;;;x,,,,,,,,,,,,,,,,,,,,,,
EVT44340OPTD;Onwards to Alaska!;;;;;;;;;;;;x,,,,,,,,,,,,,,,,,,,,,,
EVTNAME44341;The Southern Rhodesia Dominion;;;;;;;;;;;;x,,,,,,,,,,,,,,,,,,,,,,
EVTDESC44341;The colony of British Southern Rhodesia has asked to be governed as an autonomous dominion within the empire.;;;;;;;;;;;;x,,,,,,,,,,,,,,,,,,,,,,
EVT44341OPTC;Onwards to Rhodesia!;;;;;;;;;;;;x,,,,,,,,,,,,,,,,,,,,,,
EVTNAME96165;Italian Unification;;;;;;;;;;;;x,,,,,,,,,,,,,,,,,,,,,,
EVTDESC96165;The Italians have managed to unify at long last, threatening $COUNTRY_ADJ$ interests in the region. We will have to decide whether it is in our best interests to object or to make friends with the new rulers. What has been done cannot now be undone, after all, and a united Italy could be a formidable enemy or a powerful $COUNTRY_ADJ$ ally.;;;;;;;;;;;;x,,,,,,,,,,,,,,,,,,,
EVTNAME96170;Il Risorgimento;;;;;;;;;;;;x,,,,,,,,,,,,,,,,,,,,,,
EVTDESC96170;$COUNTRY$ has become the center of Italian nationalism, its people calling out for unification. Italian flags are flying in the streets of $CAPITAL$, and we must decide if we wish to support this call and bring all of Italy peacefully under our banner. If we refuse, our people will be upset... and it's unlikely the opportunity will arise again.;;;;;;;;;;;;x,,,,,,,,,,,,,,,,,,,
EVTNAME90038;The Pact of Plombières;;;;;;;;;;;;x,,,,,,,,,,,,,,,,,,,,,,
EVTDESC90038;We have been approached by a Sardinian envoy, the Count of Cavour, who has made an interesting proposal: an alliance to make war against Austria, gaining Sardinia the Austrian-held provinces of Lombardy. In exchange, Sardinia would hand over Savoy and Nice to France. It is an interesting idea, and one that allows France to take a role that would not paint us as the aggressors. Shall we agree?;;;;;;;;;;;;x,,,,,,,,,,,,,,,,,
EVTDESC90038_NEWS_LONG;According to reports, the French government has been approached by a Sardinian envoy -- the Count of Cavour -- who has made an interesting proposal: an alliance to make war against Austria, gaining Sardinia the Austrian-held provinces of Lombardy and paving the way for Italian unification. In exchange, Sardinia would hand over Savoy and Nice to France.;;;;;;;;;;;;;x,,,,,
EVTDESC90038_NEWS_MEDIUM;According to reports, the French government has been approached by a Sardinian envoy -- the Count of Cavour -- who has made an interesting proposal: an alliance to make war against Austria, gaining Sardinia the Austrian-held provinces of Lombardy and paving the way for Italian unification.;;;;;;;;;;;;;x,,,,,,
EVT90038OPTA;We will agree to the pact.;;;;;;;;;;;;x,,,,,,,,,,,,,,,,,,,,,,
EVT90038OPTB;This is not in France's best interest.;;;;;;;;;;;;x,,,,,,,,,,,,,,,,,,,,,,
EVTNAME96160;Union with Sardinia;;;;;;;;;;;;x,,,,,,,,,,,,,,,,,,,,,,
EVTDESC96160;For the good of Italian reunification, our people wish to unite with the Sardinians.;;;;;;;;;;;;x,,,,,,,,,,,,,,,,,,,,,,
EVT96160OPTA;Viva Italia!;;;;;;;;;;;;x,,,,,,,,,,,,,,,,,,,,,,
EVTNAME96161;Failure of Plombières;;;;;;;;;;;;x,,,,,,,,,,,,,,,,,,,,,,
EVTDESC96161;The Pact of Plombières has failed, and our deal with France is broken.;;;;;;;;;;;;x,,,,,,,,,,,,,,,,,,,,,,
EVT96161OPTA;Unfortunate.;;;;;;;;;;;;x,,,,,,,,,,,,,,,,,,,,,,
EVT96165OPTA;This is a threat to $COUNTRY$.;;;;;;;;;;;;x,,,,,,,,,,,,,,,,,,,,,,
EVT96165OPTB;We must reconcile with Italy.;;;;;;;;;;;;x,,,,,,,,,,,,,,,,,,,,,,
EVTNAME35305;The Guerra di Libia;;;;;;;;;;;;x,,,,,,,,,,,,,,,,,,,,,,
EVTDESC35305;The lands of Tripoli and Cyrenaica once belonged to Italy, and should again. We deserve a place in the sun!;;;;;;;;;;;;x,,,,,,,,,,,,,,,,,,,,,
EVT35305OPTA;For the glory of Italia!;;;;;;;;;;;;x,,,,,,,,,,,,,,,,,,,,,,
EVT35305OPTB;This is not the time.;;;;;;;;;;;;x,,,,,,,,,,,,,,,,,,,,,,
EVTNAME33006;Trade For Heligoland?;;;;;;;;;;;;x,,,,,,,,,,,,,,,,,,,,,,
EVTDESC33006;$FROMCOUNTRY$ has approached us with a proposition: a trade of one of our colonial states in exchange for the island of Heligoland. It's an exorbitant price for such a small island, but the alternative would be to go to war. Shall we agree to the treaty?;;;;;;;;;;;;x,,,,,,,,,,,,,,,,,,,,,
EVT33006OPTA;We agree.;;;;;;;;;;;;x,,,,,,,,,,,,,,,,,,,,,,
EVT33006OPTB;We refuse.;;;;;;;;;;;;x,,,,,,,,,,,,,,,,,,,,,,
EVTNAME33007;Germany Agrees;;;;;;;;;;;;x,,,,,,,,,,,,,,,,,,,,,,
EVTDESC33007;Germany has agreed to the proposed trade for Heligoland.;;;;;;;;;;;;x,,,,,,,,,,,,,,,,,,,,,,
EVT33007OPTA;Excellent!;;;;;;;;;;;;x,,,,,,,,,,,,,,,,,,,,,,
EVTNAME33008;Germany Has Refused;;;;;;;;;;;;x,,,,,,,,,,,,,,,,,,,,,,
EVTDESC33008;Germany has refused the proposed trade for Heligoland.;;;;;;;;;;;;x,,,,,,,,,,,,,,,,,,,,,,
EVT33008OPTA;Too bad.;;;;;;;;;;;;x,,,,,,,,,,,,,,,,,,,,,,
EVTNAME33009;For the Glory of Germany;;;;;;;;;;;;x,,,,,,,,,,,,,,,,,,,,,,
EVTDESC33009;The lands of Alsace-Lorraine rightfully belong in the hands of the German people. Perhaps the time has come to reclaim them from the French, and show the world what a united and glorious Germany can achieve? Either that or perhaps we should renounce our claims to those lands once and for all, despite the blow to our prestige and our pride.;;;;;;;;;;;;x,,,,,,,,,,,,,,,,,,,,
EVT33009OPTA;Begin the war!;;;;;;;;;;;;x,,,,,,,,,,,,,,,,,,,,
EVT33009OPTB;Renounce our claims.;;;;;;;;;;;;x,,,,,,,,,,,,,,,,,,,,
EVTNAME33010;Alsace-Lorraine is Lost;;;;;;;;;;;;x,,,,,,,,,,,,,,,,,,,,,,
EVTDESC33010;We have failed to recover Alsace-Lorraine from the hated French. Many are suggesting we should renounce our claims and move on, despite the blow to our national pride.;;;;;;;;;;;;x,,,,,,,,,,,,,,,,,,,,,
EVT33010OPTA;Never! We shall regain it... one day.;;;;;;;;;;;;x,,,,,,,,,,,,,,,,,,,,,
EVT33010OPTB;Renounce our claims.;;;;;;;;;;;;x,,,,,,,,,,,,,,,,,,,,,
EVTNAME33015;We are at War;;;;;;;;;;;;x,,,,,,,,,,,,,,,,,,,,,
EVTDESC33015;We are at war with a dire enemy. We should call our allies into battle.;;;;;;;;;;;;x,,,,,,,,,,,,,,,,,,,,,
EVT33015OPTA;Let's make sure we have everyone.;;;;;;;;;;;;x,,,,,,,,,,,,,,,,,,,,,
EVTNAME33016;Call Allies Cleanup;;;;;;;;;;;;x,,,,,,,,,,,,,,,,,,,,,
EVTNDESC33016;This removes the flag once peace is achieved.;;;;;;;;;;;;x,,,,,,,,,,,,,,,,,,,,,
EVT33016OPTA;Let's keep this clean.;;;;;;;;;;;;x,,,,,,,,,,,,,,,,,,,,,
EVTNAME33020;The League of Three Emperors;;;;;;;;;;;;x,,,,,,,,,,,,,,,,,,,,,,
EVTDESC33020;The German Kaiser has sent a delegation to $COUNTRY$ with a proposal: a resurrection of the Holy Alliance formed between Prussia, Austria and Russia which once existed after the defeat of Napoleon. It seems doubtful that such an alliance could bear fruit, but perhaps it is time to consider this idea. $COUNTRY$ has other concerns than constant conflict with the Germans, after all.;;;;;;;;;;;;x,,,,,,,,,,,,,,,,,,,
EVT33020OPTA;We will agree to the alliance.;;;;;;;;;;;;x,,,,,,,,,,,,,,,,,,,,,
EVT33020OPTB;We have no interest in this.;;;;;;;;;;;;x,,,,,,,,,,,,,,,,,,,,,
EVTNAME33025;The Spanish Pacific;;;;;;;;;;;;x,,,,,,,,,,,,,,,,,,,,,,
EVTDESC33025;With the loss of our colonial base in Manila, the administration of the Pacific Islands has become incredibly difficult. We have been approached by the $FROMCOUNTRY_ADJ$ government regarding the possibility of selling any of our remaining holdings in the Caroline and Mariana Islands. The amount offered is not much, but then again the islands are not worth much - indeed, they cost us far more than they provide. There is the additional notion that, should we disagree, $FROMCOUNTRY$ might attempt to take them by force.;;;;;;;;;;;;x,,,,,,,,,,,,,,,,,
EVT33025OPTA;Agree to sell them.;;;;;;;;;;;;x,,,,,,,,,,,,,,,,,
EVT33025OPTB;We are not interested.;;;;;;;;;;;;x,,,,,,,,,,,,,,,,,
EVTNAME33026;The $COUNTRY_ADJ$-$FROMCOUNTRY_ADJ$ Treaty of $YEAR$;;;;;;;;;;;;x,,,,,,,,,,,,,,,,,
EVTDESC33026;The $FROMCOUNTRY_ADJ$ government has agreed to the treaty. Any of their remaining holdings in the Carolinas and Marianas are ours.;;;;;;;;;;;;x,,,,,,,,,,,,,,,,,
EVT33026OPTA;Excellent.;;;;;;;;;;;;x,,,,,,,,,,,,,,,,,
EVTNAME33027;The Spanish Have Refused!;;;;;;;;;;;;x,,,,,,,,,,,,,,,,,
EVTDESC33027;Infuriatingly, the Spanish have responded by saying they will not surrender their remaining Pacific holdings to us.;;;;;;;;;;;;x,,,,,,,,,,,,,,,,,
EVT33027OPTA;Then we must consider the use of force.;;;;;;;;;;;;x,,,,,,,,,,,,,,,,,
EVT33027OPTB;Let it go.;;;;;;;;;;;;x,,,,,,,,,,,,,,,,,
EVTNAME33030;The German East Africa Company;;;;;;;;;;;;x,,,,,,,,,,,,,
EVTDESC33030;The Society for German Colonization has been attempting to colonize the Zanzibar coast for several years now, having formed the German East Africa company and signed several treaties with Swahili tribes. It now seems they are facing difficulty with rebellions and have asked us to step in. The Sultan of Zanzibar will doubtlessly object if we do, as he claims authority over the coast -- even if his actual authority is minimal -- but so what if he does? This may be an interesting opportunity.;;;;;;;;;;;;x,,,,,,,,,,,
EVT33030OPTA;Claim the coast as a $COUNTRY_ADJ$ colony.;;;;;;;;;;;;x,,,,,,,,,,,
EVT33030OPTB;We have no interest in this.;;;;;;;;;;;;x,,,,,,,,,,,
EVTNAME33031;German Warships!;;;;;;;;;;;;x,,,,,,,,,,,,,
EVTDESC33031;For the last several years, Swahili tribes on the coast have been making treaties with Europeans, allowing them to create small settlements. We knew this would be trouble, and we were right. Powerful warships have arrived from $FROMCOUNTRY$, a demonstration of their power as they make a demand for the entirety of the coast. If we do this, they say, we shall be safe from further molestation -- and they claim we do not truly control the coast anyhow.;;;;;;;;;;;;x,,,,,,,
EVT33031OPTA;An outrage! We refuse!;;;;;;;;;;;;x,,,,,,,
EVT33031OPTB;It seems we have no choice.;;;;;;;;;;;;x,,,,,,,
EVTNAME33035;The New Challenger;;;;;;;;;;;;x,,,,,,,,,,,,,
EVTDESC33035;A new contender for the German Confederation leadership has arisen!;;;;;;;;;;;;x,,,,,,,,,,,,,
EVT33035OPTA;Unacceptable!;;;;;;;;;;;;x,,,,,,,,,,,,,
EVTNAME98200;The Great Boer Trek;;;;;;;;;;;;;x,,,,,,,,,,,,,,,,,,,,,,
EVTDESC98200;The Boers are descendants of Dutch settlers in the eastern Cape Colony, and they have never sat well with British rule. More and more of them are leaving their farmsteads and moving to the east and the north-east, encroaching on territory traditionally ruled by the Xhosa and the Basotho. Conflict with those native peoples appears to be inevitable, as perhaps is conflict with the Boers themselves should we allow any lands they claim to remain independent. As far as the British government is concerned, the Boers are British subjects... no matter where they go.;;;;;;;;;;;;;x,,,,,,,,,,,,,,,,,,
EVT98200OPTA;We shall see.;;;;;;;;;;;;;x,,,,,,,,,,,,,,,,,,,,,,
EVTNAME98205;Invasion of the Laagers;;;;;;;;;;;;;x,,,,,,,,,,,,,,,,,,,,,,
EVTDESC98205;The Boers are eager to get away from British rule, slowly leaving the lands of the Cape Colony and heading both east and north into the African wilds. The ones heading east are encroaching on Zulu territory, however, and it seems there is no end to them. They possess firearms, but we have the superior manpower... and all our chiefs agree on one thing: if we do not do something about the Boers now, they will dominate our territory and turn the Zulu people into colonial subjects.;;;;;;;;;;;;;x,,,,,,,,,,,,,,,,,
EVT98205OPTA;We must drive them from our lands!;;;;;;;;;;;;;x,,,,,,,,,,,,,,,,,
EVT98205OPTB;There is no choice but to appease them.;;;;;;;;;;;;;x,,,,,,,,,,,,,,,,,
EVTNAME98206;The Battle of Blood River;;;;;;;;;;;;;x,,,,,,,,,,,,,,,,,,,,,,
EVTDESC98206;The Boer encroachment into Zulu lands has provoked a reaction: the Battle of Blood River, prompted by the massacre of Piet Retief and his fellow pioneers after they attempted to negotiate borders for the new Natal settlement. The Voortrekkers won a decisive victory at the battle, and have now carved out a new colony -- with the only question remaining whether the British will recognize their independence or continue to treat them as subjects of the crown. Either way, further conflict seems certain.;;;;;;;;;;;;;x,,,,,,,,,,,,,,,,,,,
EVT98206OPTA;They are colonial subjects, no more.;;;;;;;;;;;;;x,,,,,,,,,,,,,,,,,,,
EVT98206OPTB;The Boers will stand on their own, if they can.;;;;;;;;;;;;;x,,,,,,,,,,,,,,,,,,,
EVTNAME98207;The Natalia Republic;;;;;;;;;;;;;x,,,,,,,,,,,,,,,,,,,,,,
EVTDESC98207;The Boers which have trekked eastward into Zulu lands have reached a surprising settlement with the natives: they have staked out permanent borders for their new colony, and done so in relative peace. The real question remains whether we will allow this new Natalia Republic to stand. The Boers are British subjects, after all, and their existence will no doubt draw more Boers to their side... perhaps providing a threat to our African ambitions.;;;;;;;;;;;;;x,,,,,,,,,,,,,,,,,,,
EVT98207OPTB;Allow them to find their own way.;;;;;;;;;;;;;x,,,,,,,,,,,,,,,,,,,
EVTNAME98210;British Rule of Natal;;;;;;;;;;;;;x,,,,,,,,,,,,,,,,,,,,,,
EVTDESC98210;The Boers of Natalia are once again chafing under British rule, resenting the idea that even though they left the Cape Colony they have not escaped the British crown. There have been several altercations with British military forces, and the recommendation of the colonial government is that Natal be annexed before the situation grows worse. If we do not, then we must allow the Boers to find their own way-- and suffer the loss to our prestige this would entail.;;;;;;;;;;;;;x,,,,,,,,,,,,,,,,,,,
EVT98210OPTA;We will annex the Natal.;;;;;;;;;;;;;x,,,,,,,,,,,,,,,,,,,
EVT98210OPTB;Let them go.;;;;;;;;;;;;;x,,,,,,,,,,,,,,,,,,,
EVTNAME98211;Natalian Independence!;;;;;;;;;;;;;x,,,,,,,,,,,,,,,,,,,,,,
EVTDESC98211;After a series of altercations between British colonial forces and the Boer militia, the British crown has decided to cut its losses and allow Natal its independence. Finally we will control our own destiny, away from the British now and forever!;;;;;;;;;;;;;x,,,,,,,,,,,,,,,,,,,,
EVT98211OPTA;We will maintain good relations with the British.;;;;;;;;;;;;;x,,,,,,,,,,,,,,,,,,,
EVT98211OPTB;The Boer will find their own way -- without help.;;;;;;;;;;;;;x,,,,,,,,,,,,,,,,,,,
EVTNAME98212;The Annexation of Natalia;;;;;;;;;;;;;x,,,,,,,,,,,,,,,,,,,,,,
EVTDESC98212;After a series of altercations between British colonial forces and the Boer militia, we have received a demand from the British government that Natalia be annexed into the Cape Colony. For all our struggles to leave the British behind, they yet follow us and refuse to allow us independence! So now we are faced with a choice: submit and move on, to find a place beyond their reach once more, or defy them and risk war.;;;;;;;;;;;;;x,,,,,,,,,,,,,,,,,,
