;;;;;;;;;;;;;;;;;x
organize_malawi_desc;We should organize the African colonies to better reflect both a local structure, as well as set up the possibility for autonomous rule -- dominated by our benevolent colonial administrators, of course.;;;;;;;;;;;;;x,,,,,,,,,,,,,,,,,,,,
reorganize_malawi_title;Claim Nyasaland;;;;;;;;;;;;;x,,,,,,,,,,,,,,,,,,,,,,
reorganize_malawi_desc;Now that we have taken possession of this African colony, we should reorganize its structure to make it truly part of our greater colonial administration.;;;;;;;;;;;;;x,,,,,,,,,,,,,,,,,,,,,
organize_gambia_title;Organize the Gambia;;;;;;;;;;;;;x,,,,,,,,,,,,,,,,,,,,,,
organize_gambia_desc;We should organize the African colonies to better reflect both a local structure, as well as set up the possibility for autonomous rule -- dominated by our benevolent colonial administrators, of course.;;;;;;;;;;;;;x,,,,,,,,,,,,,,,,,,,,
reorganize_gambia_title;Claim the Gambia;;;;;;;;;;;;;x,,,,,,,,,,,,,,,,,,,,,,
reorganize_gambia_desc;Now that we have taken possession of this African colony, we should reorganize its structure to make it truly part of our greater colonial administration.;;;;;;;;;;;;;x,,,,,,,,,,,,,,,,,,,,,
reorganize_angola_title;Claim Angola;;;;;;;;;;;;;x,,,,,,,,,,,,,,,,,,,,,,
reorganize_angola_desc;Now that we have taken possession of this African colony, we should reorganize its structure to make it truly part of our greater colonial administration.;;;;;;;;;;;;;x,,,,,,,,,,,,,,,,,,,,,
reorganize_mozambique_title;Claim Mozambique;;;;;;;;;;;;;x,,,,,,,,,,,,,,,,,,,,,,
reorganize_mozambique_desc;Now that we have taken possession of this African colony, we should reorganize its structure to make it truly part of our greater colonial administration.;;;;;;;;;;;;;x,,,,,,,,,,,,,,,,,,,,,
move_capital_to_niamey_title;Move Capital to Niamey;;;;;;;;;;;;;x,,,,,,,,,,,,,,,,,,,,,,
move_capital_to_niamey_desc;Niamey provides a better capital for Niger -- we should move the government there at once.;;;;;;;;;;;;;x,,,,,,,,,,,,,,,,,,,,,,
move_capital_to_bamako_title;Move Capital to Bamako;;;;;;;;;;;;;x,,,,,,,,,,,,,,,,,,,,,,
move_capital_to_bamako_desc;Niamey provides a better capital for Mali -- we should move the government there at once.;;;;;;;;;;;;;x,,,,,,,,,,,,,,,,,,,,,,
move_capital_to_dar_es_salaam_title;Move Capital to Dar-es-Salaam;;;;;;;;;;;;;x,,,,,,,,,,,,,,,,,,,,,,
move_capital_to_dar_es_salaam_desc;Dar-es-Salaam provides a better capital for Tanganyika -- we should move the government there at once.;;;;;;;;;;;;;x,,,,,,,,,,,,,,,,,,,,,,
become_poland_title;Jeszcze Polska nie Zginela;;;;;;;;;;;;;x,,,,,,,,,,,,,,,,,,,,,,
become_poland_desc;Poland must be reborn! With Warsaw back in our hands, we must take the first step towards uniting all Polish people under a common flag!;;;;;;;;;;;;;x,,,,,,,,,,,,,,,,,,,,,
unite_with_poland_title;Unite with Poland;;;;;;;;;;;;;x,,,,,,,,,,,,,,,,,,,,,,
unite_with_poland_desc;Now that Poland has been reborn, the time has come for Krakow to rejoin the motherland.;;;;;;;;;;;;;x,,,,,,,,,,,,,,,,,,,,,
galicia_annex_krakow_title;Unite with Galicia;;;;;;;;;;;;x,,,,,,,,,,,,,,,,,,,,,,
galicia_annex_krakow_desc;The Great Powers of the world swim around us like hungry sharks, and our city alone is too small to be safe. Now that the Poles of Galicia have been freed, it would be best for us to come under their protection. Together, we shall not rest until we have liberated the rest of our Polish brethren!;;;;;;;;;;;;x,,,,,,,,,,,,,,,,,,,
krakow_form_galicia_title;Form Galicia-Lodomeria;;;;;;;;;;;;x,,,,,,,,,,,,,,,,,,,,,,
krakow_form_galicia_desc;Now that we have liberated Galicia from foreign tyranny, let us extend to its people the freedoms we ourselves hold dear. Long live free Galicia!;;;;;;;;;;;;x,,,,,,,,,,,,,,,,,,,,,
become_poland_lithuania_title;The Commonwealth Reborn;;;;;;;;;;;;x,,,,,,,,,,,,,,,,,,,,,,
become_poland_lithuania_desc;Our ancient empire has been reborn. Let Poland-Lithuania exist once again, and let our ancient enemies tremble!;;;;;;;;;;;;x,,,,,,,,,,,,,,,,,,,,,
stop_poland_lithuania_title;End the Commonwealth;;;;;;;;;;;;x,,,,,,,,,,,,,,,,,,,,,,
stop_poland_lithuania_desc;The Poland-Lithuanian union is at an end. We must put aside our dreams of greatness and return to our roots as Poland itself.;;;;;;;;;;;;x,,,,,,,,,,,,,,,,,,,,,,
unite_with_croatia_title;Unite with Croatia;;;;;;;;;;;;;x,,,,,,,,,,,,,,,,,,,,,,
unite_with_croatia_desc;Now that Croatia has been formed, the time has come for us to join the motherland.;;;;;;;;;;;;;x,,,,,,,,,,,,,,,,,,,,,
invite_slovenia_to_YUG_title;Invite Slovenia Into Yugoslavia;;;;;;;;;;;;;x,,,,,,,,,,,,,,,,,,,,,,
invite_slovenia_to_YUG_desc;Our Slovenian neighbours would surely be willing to join the Slavic union. Perhaps we should extend a hand to them?;;;;;;;;;;;;;x,,,,,,,,,,,,,,,,,,,,,,
invite_bosnia_to_YUG_title;Invite Bosnia Into Yugoslavia;;;;;;;;;;;;;x,,,,,,,,,,,,,,,,,,,,,,
invite_bosnia_to_YUG_desc;Our Bosnian neighbours would surely be willing to join the Slavic union. Perhaps we should extend a hand to them?;;;;;;;;;;;;;x,,,,,,,,,,,,,,,,,,,,,,
invite_croatia_to_YUG_title;Invite Croatia Into Yugoslavia;;;;;;;;;;;;;x,,,,,,,,,,,,,,,,,,,,,,
invite_croatia_to_YUG_desc;Our Croatian neighbours would surely be willing to join the Slavic union. Perhaps we should extend a hand to them?;;;;;;;;;;;;;x,,,,,,,,,,,,,,,,,,,,,,
invite_montenegro_to_YUG_title;Invite Montenegro Into Yugoslavia;;;;;;;;;;;;;x,,,,,,,,,,,,,,,,,,,,,,
invite_montenegro_to_YUG_desc;Our Montenegrin neighbours would surely be willing to join the Slavic union. Perhaps we should extend a hand to them?;;;;;;;;;;;;;x,,,,,,,,,,,,,,,,,,,,,,
invite_serbia_to_YUG_title;Invite Serbia Into Yugoslavia;;;;;;;;;;;;;x,,,,,,,,,,,,,,,,,,,,,,
invite_serbia_to_YUG_desc;Our Serbian neighbours would surely be willing to join the Slavic union. Perhaps we should extend a hand to them?;;;;;;;;;;;;;x,,,,,,,,,,,,,,,,,,,,,,
invite_bulgaria_to_YUG_title;Invite Bulgaria Into Yugoslavia;;;;;;;;;;;;;x,,,,,,,,,,,,,,,,,,,,,,
invite_bulgaria_to_YUG_desc;While the Bulgarians are noticeably reluctant to assent to any kind of greater union of the Balkans, perhaps with enough influence and good relations we can convince them to join us.;;;;;;;;;;;;;x,,,,,,,,,,,,,,,,,,,,,
invite_macedonia_to_YUG_title;Invite Macedonia Into Yugoslavia;;;;;;;;;;;;;x,,,,,,,,,,,,,,,,,,,,,,
invite_macedonia_to_YUG_desc;While the Macedonians are noticeably reluctant to assent to any kind of greater union of the Balkans, perhaps with enough influence and good relations we can convince them to join us.;;;;;;;;;;;;;x,,,,,,,,,,,,,,,,,,,,,
embrace_bosnians_YUG_title;Embrace the Bosniaks;;;;;;;;;;;;;x,,,,,,,,,,,,,,,,,,,,,,
embrace_bosnians_YUG_desc;The Bosniaks are historically a Muslim culture, and notoriously at odds with the rest of the Slavs. With enough effort, however, it should not be impossible to integrate them more fully into the Yugoslav culture and government. Perhaps this might even mean a future of peace between our peoples.;;;;;;;;;;;;;x,,,,,,,,,,,,,,,,,,,
embrace_bulgarians_YUG_title;Embrace Bulgarians;;;;;;;;;;;;;x,,,,,,,,,,,,,,,,,,,,,,
embrace_bulgarians_YUG_desc;The Bulgarians often do not consider themselves true Slavs, or perhaps they simply think themselves superior? Either way relations with the Bulgarians have been difficult. With enough effort, however, it should not be impossible to integrate them more fully into the Yugoslav culture and government. Perhaps this might even mean a future of peace between our peoples.;;;;;;;;;;;;;x,,,,,,,,,,,,,,,,,,,
embrace_albanians_YUG_title;Embrace Albanians;;;;;;;;;;;;;x,,,,,,,,,,,,,,,,,,,,,,
embrace_albanians_YUG_desc;The Albanians are not truly a Slavic culture, and notoriously at odds with the rest of the Slavs. With enough effort, however, it should not be impossible to integrate them more fully into the Yugoslav culture and government. Perhaps this might even mean a future of peace between our peoples.;;;;;;;;;;;;;x,,,,,,,,,,,,,,,,,,,
end_of_yugoslavia_bulgaria_title;The End of Yugoslavia;;;;;;;;;;;;;x,,,,,,,,,,,,,,,,,,,,,,
end_of_yugoslavia_bulgaria_desc;The Slavic union has been sundered. It is time to bring it to an end.;;;;;;;;;;;;;x,,,,,,,,,,,,,,,,,,,,,,
end_of_yugoslavia_greece_title;The End of Yugoslavia;;;;;;;;;;;;;x,,,,,,,,,,,,,,,,,,,,,,
end_of_yugoslavia_greece_desc;The Slavic union has been sundered. It is time to bring it to an end.;;;;;;;;;;;;;x,,,,,,,,,,,,,,,,,,,,,,
form_yugoslavia_title;Form Yugoslavia;;;;;;;;;;;;;x,,,,,,,,,,,,,,,,,,,,,,
form_yugoslavia_desc;The Slavic peoples of the Balkans must be united under a single banner: ours. It is the only way to keep us free of rule from European powers.;;;;;;;;;;;;;x,,,,,,,,,,,,,,,,,,,,,,
create_yugoslavia_title;Create Yugoslavia;;;;;;;;;;;;;x,,,,,,,,,,,,,,,,,,,,,,
create_yugoslavia_desc;If the Slavic peoples of the Balkans are united under a single flag, they will be a far more useful ally then as separate and constantly warring states.;;;;;;;;;;;;;x,,,,,,,,,,,,,,,,,,,,,
albania_in_yugoslavia_title;Incorporate Albania into Yugoslavia;;;;;;;;;;;;;x,,,,,,,,,,,,,,,,,,,,,,
albania_in_yugoslavia_desc;The Albanians must be incorporated into the larger Slavic union.;;;;;;;;;;;;;x,,,,,,,,,,,,,,,,,,,,,,
bulgaria_in_yugoslavia_title;Incorporate Bulgaria into Yugoslavia;;;;;;;;;;;;;x,,,,,,,,,,,,,,,,,,,,,,
bulgaria_in_yugoslavia_desc;The Bulgarians must be incorporated into the larger Slavic union.;;;;;;;;;;;;;x,,,,,,,,,,,,,,,,,,,,,,
end_of_yugoslavia_serbia_title;The End of Yugoslavia;;;;;;;;;;;;;x,,,,,,,,,,,,,,,,,,,,,,
end_of_yugoslavia_serbia_desc;The Slavic union has been sundered. It is time to bring it to an end.;;;;;;;;;;;;;x,,,,,,,,,,,,,,,,,,,,,,
end_of_yugoslavia_croatia_title;The End of Yugoslavia;;;;;;;;;;;;;x,,,,,,,,,,,,,,,,,,,,,,
end_of_yugoslavia_croatia_desc;The Slavic union has been sundered. It is time to bring it to an end.;;;;;;;;;;;;;x,,,,,,,,,,,,,,,,,,,,,,
end_of_yugoslavia_slovenia_title;The End of Yugoslavia;;;;;;;;;;;;;x,,,,,,,,,,,,,,,,,,,,,,
end_of_yugoslavia_slovenia_desc;The Slavic union has been sundered. It is time to bring it to an end.;;;;;;;;;;;;;x,,,,,,,,,,,,,,,,,,,,,,
end_of_yugoslavia_bosnia_title;The End of Yugoslavia;;;;;;;;;;;;;x,,,,,,,,,,,,,,,,,,,,,,
end_of_yugoslavia_bosnia_desc;The Slavic union has been sundered. It is time to bring it to an end.;;;;;;;;;;;;;x,,,,,,,,,,,,,,,,,,,,,,
end_of_yugoslavia_albania_title;The End of Yugoslavia;;;;;;;;;;;;;x,,,,,,,,,,,,,,,,,,,,,,
end_of_yugoslavia_albania_desc;The Slavic union has been sundered. It is time to bring it to an end.;;;;;;;;;;;;;x,,,,,,,,,,,,,,,,,,,,,,
end_of_yugoslavia_montenegro_title;The End of Yugoslavia;;;;;;;;;;;;;x,,,,,,,,,,,,,,,,,,,,,,
end_of_yugoslavia_montenegro_desc;The Slavic union has been sundered. It is time to bring it to an end.;;;;;;;;;;;;;x,,,,,,,,,,,,,,,,,,,,,,
form_czechoslovakia_title;Form Czechoslovakia;;;;;;;;;;;;;x,,,,,,,,,,,,,,,,,,,,,,
form_czechoslovakia_desc;Bohemia and Slovakia cannot exist alone amidst the warring powers of Europe. We must unite under a single banner!;;;;;;;;;;;;;x,,,,,,,,,,,,,,,,,,,,,,
end_of_czechoslovakia_bohemia_title;The End of Czechoslovakia;;;;;;;;;;;;;x,,,,,,,,,,,,,,,,,,,,,,
end_of_czechoslovakia_bohemia_desc;The union of Bohemia and Slovakia has been sundered. It is time to bring Czechoslovakia to an end.;;;;;;;;;;;;;x,,,,,,,,,,,,,,,,,,,,,,
end_of_czechoslovakia_slovakia_title;The End of Czechoslovakia;;;;;;;;;;;;;x,,,,,,,,,,,,,,,,,,,,,,
end_of_czechoslovakia_slovakia_desc;The union of Bohemia and Slovakia has been sundered. It is time to bring Czechoslovakia to an end.;;;;;;;;;;;;;x,,,,,,,,,,,,,,,,,,,,,,
unite_moldavia_wallachia_title;Unite Wallachia & Moldavia;;;;;;;;;;;;;x,,,,,,,,,,,,,,,,,,,,,,
unite_moldavia_wallachia_desc;The Principalities of Moldavia and Wallachia must unite under a single flag, and together achieve our destiny as a united Romania!;;;;;;;;;;;;;x,,,,,,,,,,,,,,,,,,,,,
unite_with_romania_title;Unite with Romania;;;;;;;;;;;;;x,,,,,,,,,,,,,,,,,,,,,,
unite_with_romania_desc;Now that Romania has been formed, the time has come for us to join the motherland.;;;;;;;;;;;;;x,,,,,,,,,,,,,,,,,,,,,
create_romania_title;Create Romania;;;;;;;;;;;;;x,,,,,,,,,,,,,,,,,,,,,,
create_romania_desc;A united and free Romania will make a formidable and valuable ally.;;;;;;;;;;;;;x,,,,,,,,,,,,,,,,,,,,,,
create_cambodian_protectorate_title;Create Cambodian Protectorate;;;;;;;;;;;;x,,,,,,,,,,,,,,,,,,,,,,
create_cambodian_protectorate_desc;Fearing invasion by the Siamese, the Cambodians have requested that we allow them to join the Dai Viet in protection by our nation.;;;;;;;;;;;;x,,,,,,,,,,,,,,,,,,,,,
create_laos_protectorate_title;Create Laotian Protectorate;;;;;;;;;;;;;x,,,,,,,,,,,,,,,,,,,,,,
create_laos_protectorate_desc;The Laotians will not be able to stand against their much larger neighbours… not without our help. We should approach them and offer our protection. The civilized thing to do.;;;;;;;;;;;;;x,,,,,,,,,,,,,,,,,,,,,,
siamese_border_treaty_title;Siamese Border Treaty;;;;;;;;;;;;;x,,,,,,,,,,,,,,,,,,,,,,
siamese_border_treaty_desc;Siam includes within its borders a number of conquered peoples: Laotians, Khmer and Vietnamese. A recent incident has brought to light an opportunity for us: demand that Siam release these lands, which we can then incorporate into our Indochina holdings, or face our wrath.;;;;;;;;;;;;;x,,,,,,,,,,,,,,,,,,,
unequal_treaty_DAI_title;Treaty of Hanoi;;;;;;;;;;;;;x,,,,,,,,,,,,,,,,,,,,,,
unequal_treaty_DAI_desc;The Vietnamese are in dire straits. They cannot hold out for much longer. Perhaps we should offer them the chance to go to the negotiating table, and end this war between us… on terms very much in our own favor, of course.;;;;;;;;;;;;;x,,,,,,,,,,,,,,,,,,,,
organize_laos_title;Organize Lan Xang;;;;;;;;;;;;;x,,,,,,,,,,,,,,,,,,,,,,
organize_laos_desc;We should organize the Laotian colonies to better reflect both a local structure, as well as set up the possibility for autonomous rule-- dominated by our benevolent colonial administrators, of course.;;;;;;;;;;;;;x,,,,,,,,,,,,,,,,,,,,
form_french_indochina_title;French Indochina;;;;;;;;;;;;;x,,,,,,,,,,,,,,,,,,,,,,
form_french_indochina_desc;With the colonial government taking form in Saigon, French administrators have advised elevating the region to a full department-- clearly with eyes on expanding French colonial rule to neighbours in south east Asia.;;;;;;;;;;;;;x,,,,,,,,,,,,,,,,,,,,,
unite_indonesia_title;Unite Indonesia;;;;;;;;;;;;;x,,,,,,,,,,,,,,,,,,,,,,
unite_indonesia_desc;We must unite all of the Malay, Javan, Moluccan and Melanesian people of the East Indies under a common banner. Down with the imperialists!;;;;;;;;;;;;;x,,,,,,,,,,,,,,,,,,,,
sarawak_protectorate_title;Establish Protectorate Over Sarawak;;;;;;;;;;;;;x,,,,,,,,,,,,,,,,,,,,,,
sarawak_protectorate_desc;The so-called 'White Rajah' dynasty of Sarawak has held close ties with England since its creation, and now the possibility of peacefully establishing a protectorate over this kingdom in the East Indies has arisen.;;;;;;;;;;;;;x,,,,,,,,,,,,,,,,,,,,,
sulu_protectorate_title;Establish Protectorate Over Sulu;;;;;;;;;;;;;x,,,,,,,,,,,,,,,,,,,,,,
sulu_protectorate_desc;The Sultanate of Sulu has held close ties with Spain for many years, and now the possibility of peacefully establishing a protectorate over this country in the East Indies has arisen.;;;;;;;;;;;;;x,,,,,,,,,,,,,,,,,,,,,
annex_lan_na_title;Annex Lan Na;;;;;;;;;;;;;;x;,,,,,,,,,,,,,,,,,,,,,,
annex_lan_na_desc;The Kingdom of Lan Na must unite with Siam, for the benefit of both our nations in resisting imperialist control.;;;;;;;;;;;;;;x;,,,,,,,,,,,,,,,,,,,,,
flores_sale_title;Sell Flores to the Dutch;;;;;;;;;;;;;;x;,,,,,,,,,,,,,,,,,,,,,,
flores_sale_desc;The Indonesian islands are almost worthless to us, but might be of value to the Dutch East India Company. We should consider selling them for a tidy profit.;;;;;;;;;;;;;;x;,,,,,,,,,,,,,,,,,,,,,
north_borneo_company_title;Lease North Borneo;;;;;;;;;;;;x,,,,,,,,,,,,,
north_borneo_company_desc;Rights to trading ports along the northern coast of Borneo have been granted to several companies through treaties-- and have recently fallen to Alfred Dent of London. Through him, we may conduct a new treaty that turns these rights into colonial concessions. Considering that the control of the local sultans over these areas is murky at best, and more than one has sometimes granted rights to the same areas, it truly seems as if we are obtaining clearance for the creation of a British North Borneo Company rather than wresting land from the natives.;;;;;;;;;;;;x,,,,,,,,,,
unite_malaya_title;Unite Malaysia;;;;;;;;;;;;;x,,,,,,,,,,,,,,,,,,,,,,
unite_malaya_desc;We must unite all of the Malay peoples of the East Indies under a common banner. Down with the imperialists!;;;;;;;;;;;;;x,,,,,,,,,,,,,,,,,,,,,,
create_malaya_title;Create Malaysia;;;;;;;;;;;;;x,,,,,,,,,,,,,,,,,,,,,,
create_malaya_desc;A unified and civilized federation of the Malay peoples will provide a stronger ally for our nation.;;;;;;;;;;;;;x,,,,,,,,,,,,,,,,,,,,,,
appoint_von_bismarck_title;Appoint Otto von Bismarck;;;;;;;;;;;;;x,,,,,,,,,,,,,,,,,,,,,,
appoint_von_bismarck_desc;Our nation needs a great statesman as its Chancellor, and we have just the man. Otto von Bismarck is currently the country's First Minister, but appointed as the leader of our nation he could see it transformed on the world stage.;;;;;;;;;;;;;x,,,,,,,,,,,,,,,,,,,,
otto_von_bismarck;Otto von Bismarck;;;;;;;;;;;;;x,,,,,,,,,,,,,,,,,,,,,,
otto_von_bismarck_desc;The current Chancellor of our nation, von Bismarck is a remarkable statesman… perhaps one of the finest our nation will ever know.;;;;;;;;;;;;;x,,,,,,,,,,,,,,,,,,,,,
reclaim_alsace_lorraine_title;Reclaim Alsace-Lorraine;;;;;;;;;;;;;x,,,,,,,,,,,,,,,,,,,,,,
reclaim_alsace_lorraine_desc;The neighbouring territory of Alsace-Lorraine is inhabited by German people, and rightfully belongs to Germany. We renounced our rightful claim to it, but perhaps the time has come for us to re-assert our claim and liberate the Germans who live there?;;;;;;;;;;;;;x,,,,,,,,,,,,,,,,,,,,
purchase_spanish_pacific_title;Purchase the Spanish Pacific;;;;;;;;;;;;;x,,,,,,,,,,,,,,,,,,,,,,
purchase_spanish_pacific_desc;With the Spanish having lost their colonial facilities in Manila, their Pacific holdings are difficult to administrate and incredibly expensive for them. Considering that our government's interests lie in obtaining a foothold in the Pacific, we should perhaps approach them with the notion of purchasing these islands for ourselves.;;;;;;;;;;;;;x,,,,,,,,,,,,,,,,,,,,
reclaim_poland_GER_title;Reclaim Poland;;;;;;;;;;;;;x,,,,,,,,,,,,,,,,,,,,,,
reclaim_poland_GER_desc;Our lands in Poland were stripped from us unfairly. Now is the time to reclaim those lands in the name of Germany!;;;;;;;;;;;;;x,,,,,,,,,,,,,,,,,,,,,,
league_of_three_emperors_title;The League of Three Emperors;;;;;;;;;;;;x,,,,,,,,,,,,,,,,,,,,,,
league_of_three_emperors_desc;After the defeat of Napoleon, a Holy Alliance was once formed between Prussia, Austria and Russia. Perhaps the time has come to resurrect that alliance, a common front between our three monarchies to stand against the wave of revolution and change and Europe?;;;;;;;;;;;;x,,,,,,,,,,,,,,,,,,,
league_of_three_emperors2_title;The League of Three Emperors;;;;;;;;;;;;x,,,,,,,,,,,,,
league_of_three_emperors2_desc;After the defeat of Napoleon, a Holy Alliance was once formed between Prussia, Austria and Russia. Perhaps the time has come to resurrect that alliance, a common front between our three monarchies to stand against the wave of revolution and change and Europe?;;;;;;;;;;;;x,,,,,,,,,,
annex_new_caledonia_title;Annex New Caledonia;;;;;;;;;;;;;x,,,,,,,,,,,,,,,,,,,,,,
annex_new_caledonia_desc;There is some interest within the French government of creating a penal colony-- somewhere that enemies of the monarchy could be sent, allowing them to be far away from the continent where they can do no harm. Admiral Febvrier Despointes reports that the island of New Caledonia, off the coast of Australia, might do just the trick. Considering the British have used Australia for the same purpose, who could object to us doing similarly?;;;;;;;;;;;;;x,,,,,,,,,,,,,,,,,,
claim_savoy_title;Claim Savoy;;;;;;;;;;;;;x,,,,,,,,,,,,,,,,,,,,,,
claim_savoy_desc;While we had hoped to one day regain control over Savoy through diplomatic means, with the formation of Italy that is now impossible. We must lay claim to Savoy, and liberate the French therein through force of arms.;;;;;;;;;;;;;x,,,,,,,,,,,,,,,,,,,,
french_language_schooling_title;French Language Schooling;;;;;;;;;;;;x,,,,,,,,,,,,,
french_language_schooling_desc;A motion has been put forward by the minister Jules Ferry, namely that not only should schooling in France be free -- but that it must be solely in French. Langues d'oc and other forms of patois must be stamped out so that France has cultural unity. That, he says, will give our nation the strength it needs to fully modernize.;;;;;;;;;;;;x,,,,,,,,,,
french_cultural_unity;French Cultural Unity;;;;;;;;;;;;x,,,,,,,,,,,,,
french_cultural_unity_desc;New schooling policies are slowly assimilating patois-speaking Frenchmen.;;;;;;;;;;;;x,,,,,,,,,,,,,
accademia_della_crusca_title;Accademia della Crusca;;;;;;;;;;;;x,,,,,,,,,,,,,,,,,,,,,,
accademia_della_crusca_desc;The Academy of the Crusca, the most prestigious center of study for the Italian language, would gladly appreciate an economic help from your majesty to keep on with the good work on Italian literature's history... and to pay those new paintings for the main hall;;;;;;;;;;;;x,,,,,,,,,,,,,,,,,,,,
plombieres_title;Accordo di Plombières;;;;;;;;;;;;x,,,,,,,,,,,,,,,,,,,,,,
plombieres_desc;We should seek French help to kick Austria out of Italy.;;;;;;;;;;;;x,,,,,,,,,,,,,,,,,,,,,,
garibaldi_redshirts_title;Expedition of the Thousand;;;;;;;;;;;;x,,,,,,,,,,,,,,,,,,,,,,
garibaldi_redshirts_desc;The revolutionary leader, Giuseppe Garibaldi, has called upon the Italian people to take arms in the name of unification. A volunteer army under Garibaldi's leadership will topple the southern governments and remove the stain of the Bourbon legacy from the peninsula forever.;;;;;;;;;;;;x,,,,,,,,,,,,,,,,,,,,
war_italian_independence_title;War of Italian Independence;;;;;;;;;;;;x,,,,,,,,,,,,,,,,,,,,,,
war_italian_independence_desc;It falls upon our nation to break the power that Austria has over Italy. Lombardia must be freed, at any cost.;;;;;;;;;;;;x,,,,,,,,,,,,,,,,,,,,,
italian_call_to_union;Italian Call to Union;;;;;;;;;;;;x,,,,,,,,,,,,,,,,,,,,,,
italian_call_to_union_title;Italian Call to Union;;;;;;;;;;;;x,,,,,,,,,,,,,,,,,,,,,,
italian_call_to_union_desc;The time has come to call upon the Italian people to rise up and unite under a common banner. Risorgimento must commence!;;;;;;;;;;;;x,,,,,,,,,,,,,,,,,,,,,,
we_are_italian_title;We are Italian!;;;;;;;;;;;;x,,,,,,,,,,,,,,,,,,,,,,
we_are_italian_desc;Now that we are free, it is time to reassert our Italian heritage. We must rejoin the motherland!;;;;;;;;;;;;x,,,,,,,,,,,,,,,,,,,,,
unite_with_tuscany_title;Unite with Tuscany;;;;;;;;;;;;x,,,,,,,,,,,,,,,,,,,,,,
unite_with_tuscany_desc;For the good of Italian reunification, the time has come for Lucca to unite with our Tuscan neighbours to the south.;;;;;;;;;;;;x,,,,,,,,,,,,,,,,,,,,,
objects_to_italy;Objects to Italian Unification;;;;;;;;;;;;x,,,,,,,,,,,,,,,,,,,,,,
treaty_of_ouchy_title;Treaty of Ouchy;;;;;;;;;;;;;x,,,,,,,,,,,,,,,,,,,,,,
treaty_of_ouchy_desc;Now that we possess Tripoli, we can take the Turks to the negotiating table and force them to hand over the remainder of Libya in exchange for any other provinces of theirs we hold.;;;;;;;;;;;;;x,,,,,,,,,,,,,,,,,,,,,
statuto_albertino_title;The Statuto Albertino;Le Statut albertin;Die Statuto Albertino;;El Estatuto Albertino;;;;;;;;;x
statuto_albertino_desc;The Statuto Albertino was the constitution that Charles Albert conceded to the Kingdom of Sardinia-Piedmont, in response to concerning revolutionary activity in the country, on March 4th, 1848. The Statute remained the basis of the kingdom's legal system even after Italian unification and would be used, although in modified forms, all the way up until 1948.;;;;;;;;;;;;;x,,,,,,,,,,,,,,,,,,,,,
perfect_fusion_title;Fusione Perfetta;;;;;;;;;;;;;x,,,,,,,,,,,,,,,,,,,,,,
perfect_fusion_desc;The Perfect Fusion was the 1847 act of King Charles Albert of Savoy which abolished the differences between the Kingdom of Piedmont and the Kingdom of Sardinia, in the hope to spur commercial development in Sardinia and to create a single, centralized state.;;;;;;;;;;;;;x,,,,,,,,,,,,,,,,,,,,,
become_savoy_title;Become Savoy;;;;;;;;;;;;x,,,,,,,,,,,,,,,,,,,,,,
become_savoy_desc;With the loss of Sardinia, we can no longer claim a name that belongs to a union of Sardinia and Piedmont. We must become the Duchy of Savoy once more.;;;;;;;;;;;;x,,,,,,,,,,,,,,,,,,,,,
become_piedmont_title;Become Sardinia-Piedmont;;;;;;;;;;;;x,,,,,,,,,,,,,,,,,,,,,,
become_piedmont_desc;Sardinia and Piedmont must be united into a single land once more!;;;;;;;;;;;;x,,,,,,,,,,,,,,,,,,,,,,
total_war_in_satsuma_title;Total War in Satsuma;;;;;;;;;;;;x,,,,,,,,,,,,,
total_war_in_satsuma_desc;The rebellion for all that is honourable and traditional in Japan is now upon us. We must call upon all our citizens to fight, lest our cause die before it has even achieved the first step towards victory.;;;;;;;;;;;;x,,,,,,,,,,,,
japanese_sakhalin_title;Japanese Sakhalin;;;;;;;;;;;;;x,,,,,,,,,,,,,
japanese_sakhalin_desc;With Japan now in full control of Sakhalin and the Kurils, the world must recognize that these islands are essentially part of the Japanese archipelago and know them by their Japanese names.;;;;;;;;;;;;;x,,,,,,,,,,,,
russian_sakhalin_title;Russian Sakhalin;;;;;;;;;;;;;x,,,,,,,,,,,,,
