;;;;;;;;;;;;;;;;;;;;;;;;;;;x
EVTDESC19366;Diplomats from $FROMCOUNTRY$ have quietly approached us, appealing for help in restoring their lost lands. With $COUNTRY_ADJ$, they say, $FROMCOUNTRY$ will prove a much worthier ally. There are those concerned with the trouble this might stir up, however. Should we look the other way, our prove $COUNTRY_ADJ$ influence has weight?;;;;;;;;;;;;x,,,,,,,,,,,,,,,,,
EVT19366OPTA;Tell them we shall consider it.;;;;;;;;;;;;x,,,,,,,,,,,,,,,,,
EVT19366OPTB;We cannot afford such a conflict.;;;;;;;;;;;;x,,,,,,,,,,,,,,,,,
EVTNAME19367;$FROMCOUNTRY$ Has Agreed;;;;;;;;;;;;x,,,,,,,,,,,,,,,,,,,,,,
EVTDESC19367;$FROMCOUNTRY$ has agreed to consider our proposal. It's possible they will, in the end, take no military action on our behalf… it's come to our attention that relations between them and one of our neighbours has cooled severely, however, so a war may yet come to pass.;;;;;;;;;;;;x,,,,,,,,,,,,,,,,,,
EVT19367OPTA;Then there is hope.;;;;;;;;;;;;x,,,,,,,,,,,,,,,,,,,,,,
EVTNAME19368;$FROMCOUNTRY$ Has Refused;;;;;;;;;;;;x,,,,,,,,,,,,,,,,,,,,,,
EVTDESC19368;$FROMCOUNTRY$ has refused to intervene on our behalf. Worse, it appears the purpose of our mission has leaked to at least one of our neighbours, angering them greatly bringing threats of war against $COUNTRY$. Did $FROMCOUNTRY$ inform them? Have we been abandoned by our ally?;;;;;;;;;;;;x,,,,,,,,,,,,,,,,,,,,
EVT19368OPTA;$FROMCOUNTRY_ADJ$ cowards!;;;;;;;;;;;;x,,,,,,,,,,,,,,,,,,,,
EVTNAME19370;The $FROMCOUNTRY_ADJ$ Overlords;;;;;;;;;;;;x,,,,,,,,,,,,,,,,,,,,,,
EVTDESC19370;$FROMCOUNTRY_ADJ$ soldiers marched into $CAPITAL$ today, accompanying the new $FROMCOUNTRY_ADJ$ governor who will be overseeing the operation of the $COUNTRY_ADJ$ puppet government. Already the $COUNTRY_ADJ$ people are up in arms over this imposition by a foreign power, though some are clearly questioning whether there is anything to be done. $COUNTRY$ did not submit willingly, after all, and if a rebellion breaks us free of $FROMCOUNTRY_ADJ$ control would they not simply invade once again? Perhaps $COUNTRY$ has suffered enough.;;;;;;;;;;;;x,,,,,,,,,,,,,,,,,,
EVT19370OPTA;A sad day for $COUNTRY$.;;;;;;;;;;;;x,,,,,,,,,,,,,,,,,,
EVTNAME19301;The Dream Is Over;;;;;;;;;;;;x,,,,,,,,,,,,,,,,,,
EVTDESC19301;There was once a dream in this country - a dream of a land of liberty, of new opportunities. People would flock to the United States of America seeking freedom, opportunities and shelter from the horrors of war and intolerance of the old world. The Statue of Liberty, the USA proudest symbol, used to symbolize that, and that was the first thing immigrants saw when entering our country. The Statue is still there, standing ominously in the bay of New York, but it doesn't represent that dream anymore, nor any of the values it used to. With the recrudescence of the institutions in our country, the change from a democratic government, the Statue lost all meaning and people from all over the world stopped being enchanted by what it represented. \n \n The dream is over.;;;;;;;;;;;;x,,,,,,,,,,,,,,,,,,
EVTOPTA19301;Who needs immigrants anyway?;;;;;;;;;;;;x,,,,,,,,,,,,,,,,,,
EVTDESC19006;Our independence is gradually being undercut and more and more becoming something that only exists on paper, as several foreign Great Powers vie for control over our political institutions. Recently, tensions have erupted between several great powers each vying for dominance over our government. If any of them attempts to assert themselves in $COUNTRY$, it will mean conflict with our government, the other great powers, and possibly even war.;;;;;;;;;;;;x,,,,,,,,,,,,,,,,,
EVTDESC19007;Tensions between ourselves and other Great Powers have erupted regarding dominance over the $FROMCOUNTRY_ADJ$ government. We are forced into a position where we must either assert our position, which will be seen as undercutting $FROMCOUNTRY$'s independence, or back down and lose much of the influence in $FROMCOUNTRY$ we currently hold.;;;;;;;;;;;;x,,,,,,,,,,,,,,,,,,,,
EVTNAME19015;Allies or Enemies?;;;;;;;;;;;;x,,,,,,,,,,,,,,,,,,,,
EVTDESC19015;Relations with one of our allies have cooled. Perhaps we should reconsider our alliance?;;;;;;;;;;;;x,,,,,,,,,,,,,,,,,,,,
EVT19015OPTA;Definitely.;;;;;;;;;;;;x,,,,,,,,,,,,,,,,,,,,
EVT19015OPTB;Not yet.;;;;;;;;;;;;x,,,,,,,,,,,,,,,,,,,,
EVTNAME19016;The Great Game;;;;;;;;;;;;x,,,,,,,,,,,,,,,,,,,,
EVTDESC19016;We are under the influence of a Great Power. Or we should be.;;;;;;;;;;;;x,,,,,,,,,,,,,,,,,,,,
EVT19016OPTA;We welcome our new allies.;;;;;;;;;;;;x,,,,,,,,,,,,,,,,,,,,
EVTNAME19017;Questioning Our Alliance;;;;;;;;;;;;x,,,,,,,,,,,,,,,,,,,,
EVTDESC19017;We have begun to question our alliance to a great power that is clearly not our true protector.;;;;;;;;;;;;x,,,,,,,,,,,,,,,,,,,,
EVT19017OPTA;Let us change this arrangement.;;;;;;;;;;;;x,,,,,,,,,,,,,,,,,,,,
EVTNAME19018;Alliance Broken!;;;;;;;;;;;;x,,,,,,,,,,,,,,,,,,,,
EVTDESC19018;A series of diplomatic blunders have broken our alliance!;;;;;;;;;;;;x,,,,,,,,,,,,,,,,,,,,
EVT19018OPTA;Ah, blast.;;;;;;;;;;;;x,,,,,,,,,,,,,,,,,,,,
EVT19019OPTA;But we really need that alliance!;;;;;;;;;;;;x,,,,,,,,,,,,,,,,,,,,
EVT19200OPTA;We cannot afford an immediate response to this insult.;;;;;;;;;;;;x,,,,,,,,,,,,,,,,,,,,
EVT19200OPTB;If it's a war they want...;;;;;;;;;;;;x,,,,,,,,,,,,,,,,,,,,
EVTNAME37236;The Construction of the Eiffel Tower;;;;;;;;;;;;x,,,,,,,,,,,,,,,,,,,,
EVTDESC37236;Work on the foundations of the Eiffel Tower began. Those for the east and south legs were straightforward, each leg resting on four 2 m (6.6 ft) concrete slabs, one for each of the principal girders of each leg but the other two, being closer to the river Seine, were more complicated: each slab needed two piles installed by using compressed-air caissons 15 m (49 ft) long and 6 m (20 ft) in diameter driven to a depth of 22 m (72 ft) to support the concrete slabs, which were 6 m (20 ft) thick. Each of these slabs supported a block built of limestone each with an inclined top to bear a supporting shoe for the ironwork. Each shoe was anchored into the stonework by a pair of bolts 10 cm (4 in) in diameter and 7.5 m (25 ft) long. The foundations were complete by $YEAR$ and the erection of the ironwork began. For this part, we need to set a budget for the construction.;;;;;;;;;;;;x,,,,,,,,,,,,,,,,,,,,
EVT37236OPTA;Invest more than is planned.;;;;;;;;;;;;x,,,,,,,,,,,,,,,,,,,,
EVT37236OPTB;Invest what is planned.;;;;;;;;;;;;x,,,,,,,,,,,,,,,,,,,,
EVT37236OPTC;Invest the minimum.;;;;;;;;;;;;x,,,,,,,,,,,,,,,,,,,,
EVTNAME37237;The Eiffel Tower Is Finished;;;;;;;;;;;;x,,,,,,,,,,,,,,,,,,,,
EVTDESC37237;The main structural work was completed at the end of March 1889 and today Eiffel celebrated this by leading a group of government officials, accompanied by representatives of the press, to the top of the tower. Since the lifts were not yet in operation, the ascent was made by foot, and took over an hour, Eiffel frequently stopping to make explanations of various features. Most of the party chose to stop at the lower levels, but a few, including Nouguier, Compagnon, the President of the City Council and reporters from Le Figaro and Le Monde Illustré completed the climb. At 2:35 Eiffel hoisted a large French flag, to the accompaniment of a 25-gun salute fired from the lower level. There was still work to be done, particularly on the lifts and the fitting out of the facilities for visitors, and the tower was not opened to the public. The tower was an immediate success with the public, and nearly 30,000 visitors made the 1,710-step climb to the top using the stairs before the lifts entered service.;;;;;;;;;;;;x,,,,,,,,,,,,,,,,,,,,
EVT37237OPTA;Vive la Tour Eiffel!;;;;;;;;;;;;x,,,,,,,,,,,,,,,,,,,,
EVTNAME3697000;The Construction of the Clock Tower;;;;;;;;;;;;x,,,,,,,,,,,,,,,,,,,,
EVTDESC3697000;During the rebuilding of the Palace of Westminster in the wake of the fire of 1834, the parliament determined that the new buildings should incorporate an impressive clock tower and passed a bill to that end in $YEAR$. This clock tower will take years to be built but it will be a massive accomplishment for out country. The only thing left for the building to start is to define the budget.;;;;;;;;;;;;x,,,,,,,,,,,,,,,,,,,,
EVTNAME3697001;The Clock Tower Is Finished;;;;;;;;;;;;x,,,,,,,,,,,,,,,,,,,,
EVTDESC3697001;The completion of the Clock Tower marks the end of the reconstruction of the Palace of Westminster. The clock tower was constructed on the northern extremity of the new Houses of Parliament that were built next to Westminster Hall. The commission for the clock itself demanded a high level of accuracy, the specifications drafted by the Royal Astronomer required that "the first stroke of the hour bell should register the time, correct to within one second per day, and furthermore that it should telegraph its performance twice a day to Greenwich Observatory, where a record would be kept." The second and final version of the hour bell was the largest ever cast in the UK. It was so colossal that a team of 16 horses was needed to pull the wagon upon which it rested from the foundry to the Tower. The transportation took on the character of a parade, with enthusiastic crowds lining the streets as the caravan made its way through London. The bell and tower got nicknamed "Big Ben".;;;;;;;;;;;;x,,,,,,,,,,,,,,,,,,,,
EVT3697001OPTA;A proud day for the $COUNTRY_ADJ$.;;;;;;;;;;;;x,,,,,,,,,,,,,,,,,,,,
EVTNAME95500;The $CAPITAL$ Conference of $YEAR$;;;;;;;;;;;;x,,,,,,,,,,,,,,,,,,,,,,
EVTDESC95500;The colonial powers of the world have gathered in $CAPITAL$ to discuss the regulation of colonization and trade in Africa. The outcome has become known as the 'General Act of the $CAPITAL$ Conference', formalizing the scramble for the African continent. After this point, any civilized country will largely be seen as justified in aggression towards uncivilized African nations.;;;;;;;;;;;;x,,,,,,,,,,,,,,,,,,,,
EVT95500OPTA;We must civilize all of Africa.;;;;;;;;;;;;x,,,,,,,,,,,,,,,,,,,,
EVTNAME95501;The Scramble for Africa;;;;;;;;;;;;x,,,,,,,,,,,,,,,,,,,,,,
EVTDESC95501;A conference has been held in $FROMCOUNTRY$, attended by all colonial powers, to discuss the regulation of colonization and trade in Africa. A general agreement has been reached, formalizing the scramble for the African continent. After this point, any civilized country will largely be seen as justified in aggression towards uncivilized African nations.;;;;;;;;;;;;x,,,,,,,,,,,,,,,,,,
EVTNAME95502;The Age of Colonialism;;;;;;;;;;;;x,,,,,,,,,,,,,,,,,,,,,,
EVTDESC95502;Word has reached $COUNTRY$ of a great meeting of colonial powers in Europe, wherein it was decided that African nations would be divided up amongst them -- as if our people were little more than children's toys discarded and left waiting to be picked up. This has caused a great deal of concern among those of our people with the knowledge to understand what this means. For others it has brought little more than resentment, as well as vows to fight for our independence when the day comes.;;;;;;;;;;;;x,,,,,,,,,,,,,,,,,,,,
EVT95502OPTA;This bodes ill for $COUNTRY$.;;;;;;;;;;;;x,,,,,,,,,,,,,,,,,,,,
EVTNAME95503;$COUNTRY$ in the Modern Age;;;;;;;;;;;;x,,,,,,,,,,,,,,,,,,,,,,
EVTDESC95503;'We have seen the outsiders. They come, with guns and riches we have never seen before. What they also bring is death, and we must always be wary what lies behind their smiles.' \n \n $COUNTRY$ stands on good terms with much of the western world, but our leaders are all too aware how quickly that could change. The Europeans believe we are not civilized, and the tone of our contact with them is slowly changing from friendly interest in trade to a strange paternalism coupled with cultural superiority. For now, $COUNTRY$ survives... but we must watch for the moment when the civilized nations decide our enslavement is the only way we can be 'saved'.;;;;;;;;;;;;x,,,,,,,,,,,,,,,,,
EVT95503OPTA;$COUNTRY$ shall endure.;;;;;;;;;;;;x,,,,,,,,,,,,,,,,,
EVTNAME95504;The $COUNTRY_ADJ$ Jihad;;;;;;;;;;;;x,,,,,,,,,,,,,,,,,,,,,,
EVTDESC95504;$COUNTRY_ADJ$ Muslims are calling for the Jihad to continue: all Islamic states of the Sahel, united under one flag!;;;;;;;;;;;;x,,,,,,,,,,,,,,,,,,,,,
EVT95504OPTA;For the glory of Allah!;;;;;;;;;;;;x,,,,,,,,,,,,,,,,,,,,,
EVTNAME95505;Imperialism Comes to $COUNTRY$;;;;;;;;;;;;x,,,,,,,,,,,,,,,,,,,,,,
EVTDESC95505;European presence in $COUNTRY$ is felt everywhere. Their traders come to $CAPITAL$ and dictate to our own merchants how trade will commence. They take what they want and pay what they wish. They tell our government what laws we may pass, and even when they do not we must always consider how they will react to what we do. If $COUNTRY$ does not act now, they will turn our nation into a colony under our very noses-- but perhaps that has already happened, and we must resign ourselves to their protection.;;;;;;;;;;;;x,,,,,,,,,,,,,,,,,,,
EVT95505OPTA;We have no choice but to submit.;;;;;;;;;;;;x,,,,,,,,,,,,,,,,,,,
EVT95505OPTB;Throw the Europeans out!;;;;;;;;;;;;x,,,,,,,,,,,,,,,,,,,
EVTNAME95506;The $FROMCOUNTRY_ADJ$ Protectorate;;;;;;;;;;;;x,,,,,,,,,,,,,,,,,,,,,,
EVTDESC95506;Our presence in $FROMCOUNTRY$ has reached the point where $COUNTRY_ADJ$ influence is felt in every level of their society. They are a protectorate in all but name, and the time has come for us to determine whether that status should be made official. Shall we agree to make $FROMCOUNTRY$ a protectorate and $COUNTRY_ADJ$ colony, or support their independence as a friendly ally?;;;;;;;;;;;;x,,,,,,,,,,,,,,,,,,,,
EVT95506OPTA;We will not force ourselves upon $FROMCOUNTRY$.;;;;;;;;;;;;x,,,,,,,,,,,,,,,,,,,,
EVT95506OPTB;Let us establish a protectorate.;;;;;;;;;;;;x,,,,,,,,,,,,,,,,,,,,
EVTNAME95507;Nationals Expelled from $FROMCOUNTRY$;;;;;;;;;;;;x,,,,,,,,,,,,,,,,,,,,,,
EVTDESC95507;A disturbing report has reached us of $COUNTRY_ADJ$ nationals being expelled from $FROMCOUNTRY$. Indeed, the $FROMCOUNTRY_ADJ$ government has systematically eliminated our influence -- meaning we are in a position where we must either accept the humiliation of being thrown out of an uncivilized country or step in and assert our authority. There are some who say this is a golden opportunity to establish a $FROMCOUNTRY_ADJ$ protectorate, while others say $FROMCOUNTRY$ is simply not worth the trouble.;;;;;;;;;;;;x,,,,,,,,,,,,,,,,,,,,
EVT95507OPTA;How unwise of them.;;;;;;;;;;;;x,,,,,,,,,,,,,,,,,,,,
EVT95507OPTB;We will not force ourselves upon $FROMCOUNTRY$.;;;;;;;;;;;;x,,,,,,,,,,,,,,,,,,,,
EVTNAME95508;The Sale of Assab;;;;;;;;;;;;x,,,,,,,,,,,,,,,,,,,,,,
EVTDESC95508;A $COUNTRY_ADJ$ shipping company has come into the ownership of the Red Sea port of Assab, sold to them by a local Afar sultan. The port would make for an excellent coaling station, and perhaps even provide a base for $COUNTRY$ to expand our influence in the area. Pushing for more direct control, however, could cause tensions with Assab's owner -- who might feel they have greater right to the port than the sultan.;;;;;;;;;;;;x,,,,,,,,,,,,,,,,,,
EVT95508OPTA;Push for direct control.;;;;;;;;;;;;x,,,,,,,,,,,,,,,,,,,,,
EVT95508OPTB;We have no interest in Assab.;;;;;;;;;;;;x,,,,,,,,,,,,,,,,,,,,,
EVTDESC95509;The Red Sea port of Assab has been sold to $FROMCOUNTRY$ by the local Afar sultan. They have begun to use the port as a coaling station, and fears within the $COUNTRY_ADJ$ government are that they will use this base to expand their influence within $COUNTRY$.;;;;;;;;;;;;x,,,,,,,,,,,,,,,,,,,,,
EVT95509OPTA;Assab belongs to $COUNTRY$!;;;;;;;;;;;;x,,,,,,,,,,,,,,,,,,,,
EVTNAME95510;Rebellion in Eritrea;;;;;;;;;;;;x,,,,,,,,,,,,,,,,,,,,,,
EVTDESC95510;With the Sudan in chaos, the Ethiopians have taken advantage of the situation to regain control over the coast lands. Though we may yet regain control over the Sudan, we should consider whether the Eritreans must be punished for this trespass.;;;;;;;;;;;;x,,,,,,,,,,,,,,,,,,,,
EVTNAME95512;Zemene Mesafint;;;;;;;;;;;;x,,,,,,,,,,,,,,,,,,,,,,
EVT95510OPTA;This cannot be allowed!;;;;;;;;;;;;x,,,,,,,,,,,,,,,,,,,,,,
EVT95510OPTB;Let it go.;;;;;;;;;;;;x,,,,,,,,,,,,,,,,,,,,,,
EVTNAME95511;Colonial Ambition;;;;;;;;;;;;x,,,,,,,,,,,,,,,,,,,,,,
EVTDESC95511;We must take our place among the colonial powers of Africa.;;;;;;;;;;;;x,,,,,,,,,,,,,,,,,,,,,,
EVT95511OPTA;We must act at once!;;;;;;;;;;;;x,,,,,,,,,,,,,,,,,,,,,,
EVTDESC95512;The 'Age of Princes' is upon us. The rulers of Ethiopia must struggle to unite the land under a single Emperor -- and now it is $COUNTRY$'s time to act.;;;;;;;;;;;;x,,,,,,,,,,,,,,,,,,,,,,
EVT95512OPTA;So must it be!;;;;;;;;;;;;x,,,,,,,,,,,,,,,,,,,,,,
EVTNAME95513;$FROMCOUNTRY$ Attacks!;;;;;;;;;;;;x,,,,,,,,,,,,,,,,,,,,,,
EVTDESC95513;The Zemene Mesafint -- the 'Age of Princes'-- has come to $COUNTRY$ once more. $FROMCOUNTRY$ has declared war!;;;;;;;;;;;;x,,,,,,,,,,,,,,,,,,,,,,
EVT95513OPTA;They shall pay!;;;;;;;;;;;;x,,,,,,,,,,,,,,,,,,,,,,
EVTNAME95514;The $FROMCOUNTRY$ Imperialists;;;;;;;;;;;;x,,,,,,,,,,,,,,,,,,,,,,
EVTDESC95514;They are coming!;;;;;;;;;;;;x,,,,,,,,,,,,,,,,,,,,,,
EVT95514OPTA;Oh no!;;;;;;;;;;;;x,,,,,,,,,,,,,,,,,,,,,,
EVTNAME98655;Hungarians Agree to Federation;;;;;;;;;;;;x,,,,,,,,,,,,,,,,,,,,,,
EVTDESC98655;After much discussion and deliberation, the Hungarians have agreed to expand the Austro-Hungarian union into a federation with the other Danubian cultures even if it means giving up some of their traditional claims to those lands. We may now proceed to propose the union to other local governments with full confidence that both our governments are behind it.;;;;;;;;;;;;x,,,,,,,,,,,,,,,,,,,,,
EVT98655OPTA;Excellent news!;;;;;;;;;;;;x,,,,,,,,,,,,,,,,,,,,,
EVTNAME98656;The Hungarian Counter-Proposal;;;;;;;;;;;;x,,,,,,,,,,,,,,,,,,,,,,
EVTDESC98656;After much discussion and deliberation, the Hungarians have agreed to expand the Austro-Hungarian union into a federation with the other Danubian cultures... on one condition: that they be elevated to a fully autonomous state tied to the federation only in matters of foreign relations. We can ignore their proposal, but not without causing a great deal of discontent among the Hungarian people. Sadly, this appears to be as far as their government will go on the matter.;;;;;;;;;;;;x,,,,,,,,,,,,,,,,,,,
EVT98656OPTA;Then we end it here. This is not an option.;;;;;;;;;;;;x,,,,,,,,,,,,,,,,,,,
EVT98656OPTB;We agree. Hungary will be a vassal state of the new federation.;;;;;;;;;;;;x,,,,,,,,,,,,,,,,,,,
EVT98656OPTC;We will ignore their counter-proposal. The federation shall proceed.;;;;;;;;;;;;x,,,,,,,,,,,,,,,,,,,
EVTNAME98657;The Hungarians Refuse Federation;;;;;;;;;;;;x,,,,,,,,,,,,,,,,,,,,,,
EVTDESC98657;After much discussion and deliberation, the Hungarians have outright refused the proposed federation. They do not wish to lose their equal standing with the Austrian government, and see no benefit in surrendering claims to their traditional territories. We can ignore their refusal and proceed with the federation anyhow, but not without upsetting the Hungarian people greatly.;;;;;;;;;;;;x,,,,,,,,,,,,,,,,,,,
EVT98657OPTA;Then we end it here. The federation will not come to be.;;;;;;;;;;;;x,,,,,,,,,,,,,,,,,,,
EVT98657OPTB;No matter. The federation shall proceed regardless.;;;;;;;;;;;;x,,,,,,,,,,,,,,,,,,,
EVT98666OPTA;We agree. Transylvania will be a vassal state of the new federation.;;;;;;;;;;;;x,,,,,,,,,,,,,,,,,,,
EVT98671OPTA;We agree. Croatia will be a vassal state of the new federation.;;;;;;;;;;;;x,,,,,,,,,,,,,,,,,,,
EVT98676OPTA;We agree. Slovenia will be a vassal state of the new federation.;;;;;;;;;;;;x,,,,,,,,,,,,,,,,,,,
EVT98681OPTA;We agree. Slovakia will be a vassal state of the new federation.;;;;;;;;;;;;x,,,,,,,,,,,,,,,,,,,
EVT98686OPTA;We agree. Galicia-Lodomeria will be a vassal state of the new federation.;;;;;;;;;;;;x,,,,,,,,,,,,,,,,,,,
EVTNAME98660;Czechs Agree to Federation;;;;;;;;;;;;x,,,,,,,,,,,,,,,,,,,,,,
EVTDESC98660;After much discussion and deliberation, the Czechs have agreed to the proposed Danubian Federation without reservation.;;;;;;;;;;;;x,,,,,,,,,,,,,,,,,,,,,
EVTNAME98661;The Czech Counter-Proposal;;;;;;;;;;;;x,,,,,,,,,,,,,,,,,,,,,,
EVTDESC98661;After much discussion and deliberation, the Czechs have agreed to the proposed Danubian Federation... on one condition: that they be elevated to a fully autonomous state tied to the federation only in matters of foreign relations. We can ignore their proposal, but not without causing a great deal of discontent among the Czech people. Sadly, this appears to be as far as they will go on the matter.;;;;;;;;;;;;x,,,,,,,,,,,,,,,,,,,
EVTNAME98662;The Czechs Refuse Federation;;;;;;;;;;;;x,,,,,,,,,,,,,,,,,,,,,,
EVTDESC98662;After much discussion and deliberation, the Czechs have outright refused the proposed federation. We can ignore their refusal and proceed with the federation anyhow, but not without upsetting the Czech people greatly.;;;;;;;;;;;;x,,,,,,,,,,,,,,,,,,,,
EVTNAME98665;Romanians Agree to Federation;;;;;;;;;;;;x,,,,,,,,,,,,,,,,,,,,,,
EVTDESC98665;After much discussion and deliberation, the Romanians have agreed to the proposed Danubian Federation without reservation.;;;;;;;;;;;;x,,,,,,,,,,,,,,,,,,,,,
EVTNAME98666;The Romanian Counter-Proposal;;;;;;;;;;;;x,,,,,,,,,,,,,,,,,,,,,,
EVTDESC98666;After much discussion and deliberation, the Romanians have agreed to the proposed Danubian Federation... on one condition: that they be elevated to a fully autonomous state tied to the federation only in matters of foreign relations. We can ignore their proposal, but not without causing a great deal of discontent among the Romanian people. Sadly, this appears to be as far as they will go on the matter.;;;;;;;;;;;;x,,,,,,,,,,,,,,,,,,,
EVTNAME98667;The Romanians Refuse Federation;;;;;;;;;;;;x,,,,,,,,,,,,,,,,,,,,,,
EVTDESC98667;After much discussion and deliberation, the Romanians have outright refused the proposed federation. We can ignore their refusal and proceed with the federation anyhow, but not without upsetting the Romanian people greatly.;;;;;;;;;;;;x,,,,,,,,,,,,,,,,,,,,
EVTNAME98670;Croatians Agree to Federation;;;;;;;;;;;;x,,,,,,,,,,,,,,,,,,,,,,
EVTDESC98670;After much discussion and deliberation, the Croatians have agreed to the proposed Danubian Federation without reservation.;;;;;;;;;;;;x,,,,,,,,,,,,,,,,,,,,,
EVTNAME98671;The Croatian Counter-Proposal;;;;;;;;;;;;x,,,,,,,,,,,,,,,,,,,,,,
EVTDESC98671;After much discussion and deliberation, the Croatians have agreed to the proposed Danubian Federation... on one condition: that they be elevated to a fully autonomous state tied to the federation only in matters of foreign relations. We can ignore their proposal, but not without causing a great deal of discontent among the Croatian people. Sadly, this appears to be as far as they will go on the matter.;;;;;;;;;;;;x,,,,,,,,,,,,,,,,,,,
EVTNAME98672;The Croatians Refuse Federation;;;;;;;;;;;;x,,,,,,,,,,,,,,,,,,,,,,
EVTDESC98672;After much discussion and deliberation, the Croatians have outright refused the proposed federation. We can ignore their refusal and proceed with the federation anyhow, but not without upsetting the Croatian people greatly.;;;;;;;;;;;;x,,,,,,,,,,,,,,,,,,,,
EVTNAME98675;Slovenes Agree to Federation;;;;;;;;;;;;x,,,,,,,,,,,,,,,,,,,,,,
EVTDESC98675;After much discussion and deliberation, the Slovenes have agreed to the proposed Danubian Federation without reservation.;;;;;;;;;;;;x,,,,,,,,,,,,,,,,,,,,,
EVTNAME98676;The Slovene Counter-Proposal;;;;;;;;;;;;x,,,,,,,,,,,,,,,,,,,,,,
EVTDESC98676;After much discussion and deliberation, the Slovenes have agreed to the proposed Danubian Federation... on one condition: that they be elevated to a fully autonomous state tied to the federation only in matters of foreign relations. We can ignore their proposal, but not without causing a great deal of discontent among the Slovene people. Sadly, this appears to be as far as they will go on the matter.;;;;;;;;;;;;x,,,,,,,,,,,,,,,,,,,
EVTNAME98677;The Slovenes Refuse Federation;;;;;;;;;;;;x,,,,,,,,,,,,,,,,,,,,,,
EVTDESC98677;After much discussion and deliberation, the Slovenes have outright refused the proposed federation. We can ignore their refusal and proceed with the federation anyhow, but not without upsetting the Slovene people greatly.;;;;;;;;;;;;x,,,,,,,,,,,,,,,,,,,,
EVTNAME98680;Slovakians Agree to Federation;;;;;;;;;;;;x,,,,,,,,,,,,,,,,,,,,,,
EVTDESC98680;After much discussion and deliberation, the Slovakians have agreed to the proposed Danubian Federation without reservation.;;;;;;;;;;;;x,,,,,,,,,,,,,,,,,,,,,
EVTNAME98681;The Slovakian Counter-Proposal;;;;;;;;;;;;x,,,,,,,,,,,,,,,,,,,,,,
EVTDESC98681;After much discussion and deliberation, the Slovakians have agreed to the proposed Danubian Federation... on one condition: that they be elevated to a fully autonomous state tied to the federation only in matters of foreign relations. We can ignore their proposal, but not without causing a great deal of discontent among the Slovakian people. Sadly, this appears to be as far as they will go on the matter.;;;;;;;;;;;;x,,,,,,,,,,,,,,,,,,,
EVTNAME98682;The Slovakians Refuse Federation;;;;;;;;;;;;x,,,,,,,,,,,,,,,,,,,,,,
EVTDESC98682;After much discussion and deliberation, the Slovakians have outright refused the proposed federation. We can ignore their refusal and proceed with the federation anyhow, but not without upsetting the Slovakian people greatly.;;;;;;;;;;;;x,,,,,,,,,,,,,,,,,,,,
EVTNAME98685;Polish Agree to Federation;;;;;;;;;;;;x,,,,,,,,,,,,,,,,,,,,,,
EVTDESC98685;After much discussion and deliberation, the Polish have agreed to the proposed Danubian Federation without reservation.;;;;;;;;;;;;x,,,,,,,,,,,,,,,,,,,,,
EVTNAME98686;The Polish Counter-Proposal;;;;;;;;;;;;x,,,,,,,,,,,,,,,,,,,,,,
